Jawaban tanpa Punctuation,Manual 1,Manual 2,Manual 3,Rata Manual
 teknologi informasi dapat digunakan untuk mengontrol jumlah barang yang dihasilkan dan jumlah barang yang keluar sehingga ddata yang ada dapat lebih mudah diakses dan teliti  kegiatan pemasaran yang memanfaatkan teknologi informasi seperti promosi produk via internet penjualan barang secara online dan penyedia jasacustomer serviceonline  dalam bidang manajemen karyawan teknologi informasi mempermudah manajer untuk mencari informasi tentang karyawannya,20.0,40.0,25.0,28.333333333333332
bisnis menjadi lebih efisien efektif jangkauan pemasaran lebih luas peluang lebih besar ,30.0,25.0,25.0,26.666666666666668
mempersingkat waktumemperoleh koneksi bisnis dengan cepat mempromosikan produk dengan cepat ,28.0,25.0,25.0,26.0
1 mempersingkat waktu 2 memudahkan dalam transaksi 3 memudahkan dalam melihat barang belanjaan ,25.0,30.0,25.0,26.666666666666668
untuk memudahkan kehidupan ,5.0,4.0,10.0,6.333333333333333
semakin maraknya penggunaan tik akan semakin membuka lapangan pekerjaanbisnis yang berbasis tik atau yang biasa disebut ecommerce dapat mempermudah transaksitraansaksi bisnis suatu perusahaan atau peroranga dengan fasilitas pemasangan iklan di internet pada situssitus tertentu akan mempermudah kegiatan promosi dan pemasaran suatu produk ,22.0,30.0,25.0,25.666666666666668
dapat memudahkan proses perencanaan distribusi dan produksi dalam kegiatan bisnis ,18.0,30.0,25.0,24.333333333333332
penerapan teknologi informasi dunia bisnis teknologi informasi dimanfaatkan untuk perdagangan secara elektronik atau dikenal sebagai ecommerce ecommerce adalah perdagangan menggunakan jaringan internet ,15.0,30.0,25.0,23.333333333333332
semakin maraknya penggunaan tik akan semakin membuka lapangan pekerjaan bisnis yang berbasis tik atau yang biasa disebut ecommerce dapat mempermudah transaksitraansaksi bisnis suatu perusahaan atau perorangan dengan fasilitas pemasangan iklan di internet pada situssitus tertentu akan mempermudah kegiatan promosi dan pemasaran suatu produk,22.0,35.0,25.0,27.333333333333332
1 semakin maraknya penggunaan tik akan semakin membuka lapangan pekerjaan 2 bisnis yang berbasis tik atau yang biasa disebut ecommerce dapat mempermudah transaksitraansaksi bisnis suatu perusahaan atau perorangan 3 dengan fasilitas pemasangan iklan di internet pada situssitus tertentu akan mempermudah kegiatan promosi dan pemasaran suatu produk ,22.0,40.0,25.0,29.0
memperluas pangsa pasar mengurangi biaya produksi dan operasional mempermudah proses komunikasi dan monitoring setiap karyawan munculnya peluang bisnis baru yakni ebusiness ,40.0,50.0,50.0,46.666666666666664
dapat menyimpan filefile yang penting ,18.0,10.0,10.0,12.666666666666666
mempercepat kinerja bisnis membuat pekerjaan bisnis jadi lebih mudah mempermudah memonitoring karyawan ,29.0,20.0,25.0,24.666666666666668
1 untuk pengembang bisnis 2 untuk memperluas bisnis 3 untuk mengenalkan bisnis kita ,22.0,20.0,25.0,22.333333333333332
untuk memudahkan pemasaran  memudahkan pengolahan data  sarana yang mudah bagi masyarakat ,37.0,28.0,25.0,30.0
mempermudah koneksi antar perusahaan menambah penghasilan secara cepat ,30.0,29.0,25.0,28.0
lebih efisien lebih hemat lebih aman,26.0,30.0,25.0,27.0
mempermudah transaksi bisnis mempermudah kegiatan promosi mempermudah proses pendidikan ,21.0,25.0,25.0,23.666666666666668
berikut ini adalah keuntungan dari teknologi informasi dan komunikasi  1 membantu mempercepat pekerjaan manusia 2 mempermudah komunikasi jarak jauh 3 mempermudah sistem administrasi 4 mempermudah proses transaksi keuangan ,37.0,45.0,50.0,44.0
praktis memudahkan ,10.0,10.0,10.0,10.0
kecepatan transaksi kenyamanan pelanggan ketepatan transaksi ,17.0,15.0,25.0,19.0
 sebagai media pemasaran  transaksi  sebagai media komunikasi  sebagai media promosi,22.0,35.0,25.0,27.333333333333332
dengan adanya teknologi kita dapat memanfaatkannya untuk promosi produk kepada konsumen kita dapat mengembangkan produk yang kita buat dengan mudah dengan bantuan informasi yang terbaru kita dapat menciptakan sesuatu yang baru dan unik untuk produk yang kita buat dengan memanfaatkan teknologi yang sedang berkembang saat ini,30.0,40.0,50.0,40.0
mempermudah dalam menjalankan bisnis memberikan layanan yang real time praktis mudah cepat efektif dan efisen aman,27.0,25.0,25.0,25.666666666666668
bisnis dapat terstruktur dengan lebih baik lebih mudah mengelolanya ,12.0,20.0,25.0,19.0
bisnis dapat menjadi lebih terstruktur lebih mudah pengelolaannya dan kita dapat memantau traffic bisnis yang sedang berjalan sehingga dapat meningkatkan produksi barang dan keuntungan perusahaan ,22.0,30.0,25.0,25.666666666666668
pemasaran semakin luas dan mudah pengelolaan data atau uang menjadi lebih mudah dan tidak ada kacau ,27.0,30.0,25.0,27.333333333333332
mempermudah dalam bidang pemasaran mempermudah dalam bidang pembayaran mempermudah dalam mereview produk,21.0,25.0,25.0,23.666666666666668
mempermudah dalam transaksi jual beli ,18.0,15.0,25.0,19.333333333333332
 mendapat keuntungan  memudahkan transaksi  memudahkan mengirim uang,20.0,35.0,25.0,26.666666666666668
 cepat  efektif  efisien  praktis  mudah,14.0,30.0,25.0,23.0
mempermudah proses transaksi bisnis memperluas jangkauan pasar memudahkan dokumentasi berkas,18.0,30.0,25.0,24.333333333333332
menghemat waktu karena pesan lebih cepat diterima oleh penerima pengirim tidak perlu menunggu lama agar pesannya dibaca oleh penerima menghemat tenaga dan biaya karena pengirim tidak perlu datang ke kantor pos untuk mengirim surat menghemat biaya karena dengan internet messenger dapat melakukan komunikasi jarak jauh dapat bertatapan langsung dengan lawan bicara jika komputernya dilengkapi dengan webcam yaitu alat yang berupa kamera memudahkan pencarian dokumen karena dokumen tersimpan dengan rapi dan lebih aman jika dibandingkan dengan penyimpanan secara manual ,30.0,50.0,50.0,43.333333333333336
 membantu mempercepat pekerjaan manusia  mempermudah sistem administrasi  mempermudah proses transaksi keuangan  mempermudah sistem administrasi  mempermudah kegiatan promosi dan pemasaran suatu produk,33.0,45.0,50.0,42.666666666666664
kemajuan teknologi komunikasi yang cepat dapat mempermudah komunikasi antara suatu tempat dan tempat yang lain semakin maraknya penggunaan tik akan semakin membuka lapangan pekerjaan bisnis yang berbasis tik atau yang biasa disebut ecommerce dapat mempermudah transaksitraansaksi bisnis suatu perusahaan atau perorangan dengan fasilitas pemasangan iklan di internet pada situssitus tertentu akan mempermudah kegiatan promosi dan pemasaran suatu produk,28.0,40.0,50.0,39.333333333333336
 membantu mempercepat pekerjaan manusia dengan menggunakan teknologi informasi dan komunikasi pekerjaan manusia akan menjadi lebih cepat dan mudah misalnya proses pembuatan proposal yaysan sosial apabila menggunakan mesin ketik maka diperlukan wakt,22.0,25.0,25.0,24.0
semakin maraknya penggunaan tik akan semakin membuka lapangan pekerjaan bisnis yang berbasis tik atau yang biasa disebut ecommerce dapat mempermudah transaksitraansaksi bisnis suatu perusahaan atau perorangan dengan fasilitas pemasangan iklan di internet pada situssitus tertentu akan mempermudah kegiatan promosi dan pemasaran suatu produk,24.0,25.0,25.0,24.666666666666668
 komunikasi yang cepat  teknologi sebagai media promosi  kecepatan bertransaksi  jangkauan pasar yang luas,28.0,35.0,25.0,29.333333333333332
 munculnya peluang bisnis baru yakni ebusiness  memperluas pangsa pasar  mengurangi biaya produksi dan operasional,31.0,35.0,25.0,30.333333333333332
memperbanyak keuntungan mempermudah pekerjaan biaya rendah ,25.0,20.0,25.0,23.333333333333332
tidak ada jarak tempat aantara penjual dan pembeli tidak ada jarak tempat aantara penjual dan pembeli ,18.0,40.0,25.0,27.666666666666668
kegiatan bisnis mudah berjalan tidak ada batas jarak antara penjual dan pembeli tidak ada batas waktu antara penjual dan pembeli ,25.0,45.0,25.0,31.666666666666668
mempermudah dalam pengolahan datadata yang ada dalam dunia bisnis ,15.0,10.0,10.0,11.666666666666666
pekerjaan lebih efisien menejemen database mudah melakukan transaksi ,20.0,20.0,25.0,21.666666666666668
 jaringan bisnis turun menurun  jika bisnis lancar uang juga lancar  client lebih suka pembisnis yg profesional,15.0,15.0,10.0,13.333333333333334
bisnis berjalan cepat  dapat maju dengan peasat  banyak informasi yang di dapat ,24.0,20.0,25.0,23.0
hemat waktu hemat biaya lebih rapi ,17.0,25.0,25.0,22.333333333333332
efisien hemat cepat dan efektif ,22.0,25.0,25.0,24.0
cepat tepat mudah ,17.0,10.0,25.0,17.333333333333332
informasi yang dibutuhkan akan semakin cepat dan mudah di akses untuk kepentingan pendidikan inovasi dalam pembelajaran semakin berkembang dengan adanya inovasi elearning yang semakin memudahkan proses pendidikan kemajuan tik juga akan memungkinkan berkembangnya kelas virtual atau kelas yang berbasis teleconference yang tidak mengharuskan sang pendidik dan peserta didik berada dalam satu ruangan ,22.0,30.0,25.0,25.666666666666668
mempermudah pekerjaan dan pengolahan angka ,7.0,5.0,10.0,7.333333333333333
lebih ringkas lebih cepat lebih mudah,15.0,20.0,25.0,20.0
