Siswa,Jawaban,Manual 1,Manual 2,Manual 3,Rata Manual
siswa_168,"Kerajaan Majapahit ialah sebuah kerajaan Hindu terbesar yang pernah ada di Indonesia. Kerajaan ini adalah sebuah kerajaan yang berpusat di daerah Mojokerto lebih tepatnya di daerah Trowulan. Kerajaan ini adalah salah satu kerajaan Hindu dan mengalami masa kejayaan pada era Hayam Wuruk karena seluruh wilayah Indonesia dikuasai oleh Majapahit. Selain memiliki raja yang besar Majapahit juga memiliki salah satu mahapatih terkenal yaitu,Gajahmada yang terkenal dengan Sumpah Palapa",85.0,80.0,90.0,85.0
siswa_169,"Kerajaan Majapahit adalah sebuah negara Hindu terbesar yang pernah ada di Indonesia. Kerajaan ini adalah sebuah kerajaan yang berpusat di daerah Mojokerto lebih tepatnya di daerah Trowulan. Kerajaan ini adalah salah satu kerajaan Hindu dan mengalami masa kejayaan pada era Hayam Wuruk karena seluruh wilayah Indonesia dikuasai oleh Majapahit. Selain memiliki raja yang besar Majapahit juga memiliki salah satu mahapatih terkenal yaitu,Gajahmada yang terkenal dengan Sumpah Palapa",85.0,80.0,90.0,85.0
siswa_170,"negara nan berpusan dalam jawa timur, yang pernah berdiri pada tahub 1293 hingga 1500 M",28.0,30.0,25.0,27.666666666666668
siswa_171,"negara nan berpusan di jawa timur, yang pernah berdiri pada tahub 1293 hingga 1500 M",28.0,30.0,25.0,27.666666666666668
siswa_172,"negara yang berpusan dalam jawa timur, yang pernah berdiri pada tahub 1293 hingga 1500 M",28.0,30.0,25.0,27.666666666666668
siswa_173,"negara yang berpusan di jawa timur, yang pernah berdiri pada tahub 1293 hingga 1500 M",28.0,30.0,25.0,27.666666666666668
siswa_174,"kerajaan nan berpusan dalam jawa timur, yang pernah berdiri pada tahub 1293 hingga 1500 M",28.0,30.0,25.0,27.666666666666668
siswa_175,"kerajaan nan berpusan di jawa timur, yang pernah berdiri pada tahub 1293 hingga 1500 M",28.0,30.0,25.0,27.666666666666668
siswa_176,"kerajaan yang berpusan dalam jawa timur, yang pernah berdiri pada tahub 1293 hingga 1500 M",28.0,30.0,25.0,27.666666666666668
siswa_177,"majapahit ialah sebuah negara nan berpusat di jawa timur, indonesia, yang pernah berdiri dari sekitar tahun 1293 hingga 1500 M. kerajaan ini mencapai puncak kejayaan menjadi kemaharajaaan raya yang menguasai wilayah yang luas di nusantara pada masa kekuasaan hayam wuruk, yang berkuasa dari tahun 1350 hingga 1389.",53.0,50.0,50.0,51.0
siswa_178,"majapahit ialah sebuah negara yang berpusat di jawa timur, indonesia, yang pernah berdiri dari sekitar tahun 1293 hingga 1500 M. kerajaan ini mencapai puncak kejayaan menjadi kemaharajaaan raya yang menguasai wilayah yang luas di nusantara pada masa kekuasaan hayam wuruk, yang berkuasa dari tahun 1350 hingga 1389.",53.0,50.0,50.0,51.0
siswa_179,"majapahit ialah sebuah kerajaan nan berpusat di jawa timur, indonesia, yang pernah berdiri dari sekitar tahun 1293 hingga 1500 M. kerajaan ini mencapai puncak kejayaan menjadi kemaharajaaan raya yang menguasai wilayah yang luas di nusantara pada masa kekuasaan hayam wuruk, yang berkuasa dari tahun 1350 hingga 1389.",53.0,50.0,50.0,51.0
siswa_180,"majapahit ialah sebuah kerajaan yang berpusat di jawa timur, indonesia, yang pernah berdiri dari sekitar tahun 1293 hingga 1500 M. kerajaan ini mencapai puncak kejayaan menjadi kemaharajaaan raya yang menguasai wilayah yang luas di nusantara pada masa kekuasaan hayam wuruk, yang berkuasa dari tahun 1350 hingga 1389.",53.0,50.0,50.0,51.0
siswa_181,"majapahit adalah sebuah negara nan berpusat di jawa timur, indonesia, yang pernah berdiri dari sekitar tahun 1293 hingga 1500 M. kerajaan ini mencapai puncak kejayaan menjadi kemaharajaaan raya yang menguasai wilayah yang luas di nusantara pada masa kekuasaan hayam wuruk, yang berkuasa dari tahun 1350 hingga 1389.",53.0,50.0,50.0,51.0
siswa_182,"majapahit adalah sebuah negara yang berpusat di jawa timur, indonesia, yang pernah berdiri dari sekitar tahun 1293 hingga 1500 M. kerajaan ini mencapai puncak kejayaan menjadi kemaharajaaan raya yang menguasai wilayah yang luas di nusantara pada masa kekuasaan hayam wuruk, yang berkuasa dari tahun 1350 hingga 1389.",53.0,50.0,50.0,51.0
siswa_183,"majapahit adalah sebuah kerajaan nan berpusat di jawa timur, indonesia, yang pernah berdiri dari sekitar tahun 1293 hingga 1500 M. kerajaan ini mencapai puncak kejayaan menjadi kemaharajaaan raya yang menguasai wilayah yang luas di nusantara pada masa kekuasaan hayam wuruk, yang berkuasa dari tahun 1350 hingga 1389.",53.0,50.0,50.0,51.0
siswa_184,negara dalam daratan jawa,10.0,10.0,10.0,10.0
siswa_185,negara dalam pulau jawa,10.0,10.0,10.0,10.0
siswa_186,negara di daratan jawa,10.0,10.0,10.0,10.0
siswa_187,negara di pulau jawa,10.0,10.0,10.0,10.0
siswa_188,kerajaan dalam daratan jawa,10.0,10.0,10.0,10.0
siswa_189,kerajaan dalam pulau jawa,10.0,10.0,10.0,10.0
siswa_190,kerajaan di daratan jawa,10.0,10.0,10.0,10.0
siswa_191,"Majapahit ialah sebuah negara nan berpusat di Jawa Timur, Indonesia, yang pernah berdiri dari sekitar tahun 1293 hingga 1500 M. Kerajaan ini mencapai puncak kejayaannya menjadi kemaharajaan raya yang menguasai wilayah yang luas di Nusantara pada masa kekuasaan Hayam Wuruk, yang berkuasa dari tahun 1350 hingga 1389. Kerajaan Majapahit adalah kerajaan Hindu-Buddha terakhir yang menguasai Nusantara dan dianggap sebagai salah satu dari negara terbesar dalam sejarah Indonesia.[2] Menurut Negarakertagama, kekuasaannya terbentang di Jawa, Sumatra, Semenanjung Malaya, Kalimantan, hingga Indonesia timur, meskipun wilayah kekuasaannya masih diperdebatkan. Sebelum berdirinya Majapahit, Singhasari telah menjadi kerajaan paling kuat di Jawa. Hal ini menjadi perhatian Kubilai Khan, penguasa Dinasti Yuan di Tiongkok. Ia mengirim utusan yang bernama Meng Chi[14] ke Singhasari yang menuntut upeti. Kertanagara, penguasa kerajaan Singhasari yang terakhir menolak untuk membayar upeti dan mempermalukan utusan tersebut dengan merusak wajahnya dan memotong telinganya.[14][15] Kubilai Khan marah dan lalu memberangkatkan ekspedisi besar ke Jawa tahun 1293. Ketika itu, Jayakatwang, adipati Kediri, sudah menggulingkan dan membunuh Kertanegara. Atas saran Aria Wiraraja, Jayakatwang memberikan pengampunan kepada Raden Wijaya, menantu Kertanegara, yang datang menyerahkan diri. Kemudian, Wiraraja mengirim utusan ke Daha, yang membawa surat berisi pernyataan, Raden Wijaya menyerah dan ingin mengabdi kepada Jayakatwang.[16] Jawaban dari surat di atas disambut dengan senang hati.[16] Raden Wijaya kemudian diberi hutan Tarik. Ia membuka hutan itu dan membangun desa baru. Desa itu dinamai Majapahit, yang namanya diambil dari buah maja, dan rasa ""pahit"" dari buah tersebut. Ketika pasukan Mongol tiba, Wijaya bersekutu dengan pasukan Mongol untuk bertempur melawan Jayakatwang. Setelah berhasil menjatuhkan Jayakatwang, Raden Wijaya berbalik menyerang sekutu Mongolnya sehingga memaksa mereka menarik pulang kembali pasukannya secara kalang-kabut karena mereka berada di negeri asing.[17][18] Saat itu juga merupakan kesempatan terakhir mereka untuk menangkap angin muson agar dapat pulang, atau mereka terpaksa harus menunggu enam bulan lagi di pulau yang asing. Tanggal pasti yang digunakan sebagai tanggal kelahiran kerajaan Majapahit adalah hari penobatan Raden Wijaya sebagai raja, yaitu tanggal 15 bulan Kartika tahun 1215 saka yang bertepatan dengan tanggal 10 November 1293. Ia dinobatkan dengan nama resmi Kertarajasa Jayawardhana. Kerajaan ini menghadapi masalah. Beberapa orang terpercaya Kertarajasa, termasuk Ranggalawe, Sora, dan Nambi memberontak melawannya, meskipun pemberontakan tersebut tidak berhasil. Pemberontakan Ranggalawe ini didukung oleh Panji Mahajaya, Ra Arya Sidi, Ra Jaran Waha, Ra Lintang, Ra Tosan, Ra Gelatik, dan Ra Tati. Semua ini tersebut disebutkan dalam Pararaton.[19] Slamet Muljana menduga bahwa mahapatih Halayudha lah yang melakukan konspirasi untuk menjatuhkan semua orang tepercaya raja, agar ia dapat mencapai posisi tertinggi dalam pemerintahan. Namun setelah kematian pemberontak terakhir (Kuti), Halayudha ditangkap dan dipenjara, dan lalu dihukum mati.[18] Wijaya meninggal dunia pada tahun 1309. Putra dan penerus Wijaya adalah Jayanegara. Pararaton menyebutnya Kala Gemet, yang berarti ""penjahat lemah"". Kira-kira pada suatu waktu dalam kurun pemerintahan Jayanegara, seorang pendeta Italia, Odorico da Pordenone mengunjungi keraton Majapahit di Jawa. Pada tahun 1328, Jayanegara dibunuh oleh tabibnya, Tanca. Ibu tirinya yaitu Gayatri Rajapatni seharusnya menggantikannya, akan tetapi Rajapatni memilih mengundurkan diri dari istana dan menjadi bhiksuni. Rajapatni menunjuk anak perempuannya Tribhuwana Wijayatunggadewi untuk menjadi ratu Majapahit. Pada tahun 1336, Tribhuwana menunjuk Gajah Mada sebagai Mahapatih, pada saat pelantikannya Gajah Mada mengucapkan Sumpah Palapa yang menunjukkan rencananya untuk melebarkan kekuasaan Majapahit dan membangun sebuah kemaharajaan. Selama kekuasaan Tribhuwana, kerajaan Majapahit berkembang menjadi lebih besar dan terkenal di kepulauan Nusantara. Tribhuwana berkuasa di Majapahit sampai kematian ibunya pada tahun 1350. Ia diteruskan oleh putranya, Hayam Wuruk.",82.0,89.0,90.0,87.0
siswa_192,"Majapahit ialah sebuah negara yang berpusat di Jawa Timur, Indonesia, yang pernah berdiri dari sekitar tahun 1293 hingga 1500 M. Kerajaan ini mencapai puncak kejayaannya menjadi kemaharajaan raya yang menguasai wilayah yang luas di Nusantara pada masa kekuasaan Hayam Wuruk, yang berkuasa dari tahun 1350 hingga 1389. Kerajaan Majapahit adalah kerajaan Hindu-Buddha terakhir yang menguasai Nusantara dan dianggap sebagai salah satu dari negara terbesar dalam sejarah Indonesia.[2] Menurut Negarakertagama, kekuasaannya terbentang di Jawa, Sumatra, Semenanjung Malaya, Kalimantan, hingga Indonesia timur, meskipun wilayah kekuasaannya masih diperdebatkan. Sebelum berdirinya Majapahit, Singhasari telah menjadi kerajaan paling kuat di Jawa. Hal ini menjadi perhatian Kubilai Khan, penguasa Dinasti Yuan di Tiongkok. Ia mengirim utusan yang bernama Meng Chi[14] ke Singhasari yang menuntut upeti. Kertanagara, penguasa kerajaan Singhasari yang terakhir menolak untuk membayar upeti dan mempermalukan utusan tersebut dengan merusak wajahnya dan memotong telinganya.[14][15] Kubilai Khan marah dan lalu memberangkatkan ekspedisi besar ke Jawa tahun 1293. Ketika itu, Jayakatwang, adipati Kediri, sudah menggulingkan dan membunuh Kertanegara. Atas saran Aria Wiraraja, Jayakatwang memberikan pengampunan kepada Raden Wijaya, menantu Kertanegara, yang datang menyerahkan diri. Kemudian, Wiraraja mengirim utusan ke Daha, yang membawa surat berisi pernyataan, Raden Wijaya menyerah dan ingin mengabdi kepada Jayakatwang.[16] Jawaban dari surat di atas disambut dengan senang hati.[16] Raden Wijaya kemudian diberi hutan Tarik. Ia membuka hutan itu dan membangun desa baru. Desa itu dinamai Majapahit, yang namanya diambil dari buah maja, dan rasa ""pahit"" dari buah tersebut. Ketika pasukan Mongol tiba, Wijaya bersekutu dengan pasukan Mongol untuk bertempur melawan Jayakatwang. Setelah berhasil menjatuhkan Jayakatwang, Raden Wijaya berbalik menyerang sekutu Mongolnya sehingga memaksa mereka menarik pulang kembali pasukannya secara kalang-kabut karena mereka berada di negeri asing.[17][18] Saat itu juga merupakan kesempatan terakhir mereka untuk menangkap angin muson agar dapat pulang, atau mereka terpaksa harus menunggu enam bulan lagi di pulau yang asing. Tanggal pasti yang digunakan sebagai tanggal kelahiran kerajaan Majapahit adalah hari penobatan Raden Wijaya sebagai raja, yaitu tanggal 15 bulan Kartika tahun 1215 saka yang bertepatan dengan tanggal 10 November 1293. Ia dinobatkan dengan nama resmi Kertarajasa Jayawardhana. Kerajaan ini menghadapi masalah. Beberapa orang terpercaya Kertarajasa, termasuk Ranggalawe, Sora, dan Nambi memberontak melawannya, meskipun pemberontakan tersebut tidak berhasil. Pemberontakan Ranggalawe ini didukung oleh Panji Mahajaya, Ra Arya Sidi, Ra Jaran Waha, Ra Lintang, Ra Tosan, Ra Gelatik, dan Ra Tati. Semua ini tersebut disebutkan dalam Pararaton.[19] Slamet Muljana menduga bahwa mahapatih Halayudha lah yang melakukan konspirasi untuk menjatuhkan semua orang tepercaya raja, agar ia dapat mencapai posisi tertinggi dalam pemerintahan. Namun setelah kematian pemberontak terakhir (Kuti), Halayudha ditangkap dan dipenjara, dan lalu dihukum mati.[18] Wijaya meninggal dunia pada tahun 1309. Putra dan penerus Wijaya adalah Jayanegara. Pararaton menyebutnya Kala Gemet, yang berarti ""penjahat lemah"". Kira-kira pada suatu waktu dalam kurun pemerintahan Jayanegara, seorang pendeta Italia, Odorico da Pordenone mengunjungi keraton Majapahit di Jawa. Pada tahun 1328, Jayanegara dibunuh oleh tabibnya, Tanca. Ibu tirinya yaitu Gayatri Rajapatni seharusnya menggantikannya, akan tetapi Rajapatni memilih mengundurkan diri dari istana dan menjadi bhiksuni. Rajapatni menunjuk anak perempuannya Tribhuwana Wijayatunggadewi untuk menjadi ratu Majapahit. Pada tahun 1336, Tribhuwana menunjuk Gajah Mada sebagai Mahapatih, pada saat pelantikannya Gajah Mada mengucapkan Sumpah Palapa yang menunjukkan rencananya untuk melebarkan kekuasaan Majapahit dan membangun sebuah kemaharajaan. Selama kekuasaan Tribhuwana, kerajaan Majapahit berkembang menjadi lebih besar dan terkenal di kepulauan Nusantara. Tribhuwana berkuasa di Majapahit sampai kematian ibunya pada tahun 1350. Ia diteruskan oleh putranya, Hayam Wuruk.",82.0,89.0,90.0,87.0
siswa_193,"Majapahit ialah sebuah kerajaan nan berpusat di Jawa Timur, Indonesia, yang pernah berdiri dari sekitar tahun 1293 hingga 1500 M. Kerajaan ini mencapai puncak kejayaannya menjadi kemaharajaan raya yang menguasai wilayah yang luas di Nusantara pada masa kekuasaan Hayam Wuruk, yang berkuasa dari tahun 1350 hingga 1389. Kerajaan Majapahit adalah kerajaan Hindu-Buddha terakhir yang menguasai Nusantara dan dianggap sebagai salah satu dari negara terbesar dalam sejarah Indonesia.[2] Menurut Negarakertagama, kekuasaannya terbentang di Jawa, Sumatra, Semenanjung Malaya, Kalimantan, hingga Indonesia timur, meskipun wilayah kekuasaannya masih diperdebatkan. Sebelum berdirinya Majapahit, Singhasari telah menjadi kerajaan paling kuat di Jawa. Hal ini menjadi perhatian Kubilai Khan, penguasa Dinasti Yuan di Tiongkok. Ia mengirim utusan yang bernama Meng Chi[14] ke Singhasari yang menuntut upeti. Kertanagara, penguasa kerajaan Singhasari yang terakhir menolak untuk membayar upeti dan mempermalukan utusan tersebut dengan merusak wajahnya dan memotong telinganya.[14][15] Kubilai Khan marah dan lalu memberangkatkan ekspedisi besar ke Jawa tahun 1293. Ketika itu, Jayakatwang, adipati Kediri, sudah menggulingkan dan membunuh Kertanegara. Atas saran Aria Wiraraja, Jayakatwang memberikan pengampunan kepada Raden Wijaya, menantu Kertanegara, yang datang menyerahkan diri. Kemudian, Wiraraja mengirim utusan ke Daha, yang membawa surat berisi pernyataan, Raden Wijaya menyerah dan ingin mengabdi kepada Jayakatwang.[16] Jawaban dari surat di atas disambut dengan senang hati.[16] Raden Wijaya kemudian diberi hutan Tarik. Ia membuka hutan itu dan membangun desa baru. Desa itu dinamai Majapahit, yang namanya diambil dari buah maja, dan rasa ""pahit"" dari buah tersebut. Ketika pasukan Mongol tiba, Wijaya bersekutu dengan pasukan Mongol untuk bertempur melawan Jayakatwang. Setelah berhasil menjatuhkan Jayakatwang, Raden Wijaya berbalik menyerang sekutu Mongolnya sehingga memaksa mereka menarik pulang kembali pasukannya secara kalang-kabut karena mereka berada di negeri asing.[17][18] Saat itu juga merupakan kesempatan terakhir mereka untuk menangkap angin muson agar dapat pulang, atau mereka terpaksa harus menunggu enam bulan lagi di pulau yang asing. Tanggal pasti yang digunakan sebagai tanggal kelahiran kerajaan Majapahit adalah hari penobatan Raden Wijaya sebagai raja, yaitu tanggal 15 bulan Kartika tahun 1215 saka yang bertepatan dengan tanggal 10 November 1293. Ia dinobatkan dengan nama resmi Kertarajasa Jayawardhana. Kerajaan ini menghadapi masalah. Beberapa orang terpercaya Kertarajasa, termasuk Ranggalawe, Sora, dan Nambi memberontak melawannya, meskipun pemberontakan tersebut tidak berhasil. Pemberontakan Ranggalawe ini didukung oleh Panji Mahajaya, Ra Arya Sidi, Ra Jaran Waha, Ra Lintang, Ra Tosan, Ra Gelatik, dan Ra Tati. Semua ini tersebut disebutkan dalam Pararaton.[19] Slamet Muljana menduga bahwa mahapatih Halayudha lah yang melakukan konspirasi untuk menjatuhkan semua orang tepercaya raja, agar ia dapat mencapai posisi tertinggi dalam pemerintahan. Namun setelah kematian pemberontak terakhir (Kuti), Halayudha ditangkap dan dipenjara, dan lalu dihukum mati.[18] Wijaya meninggal dunia pada tahun 1309. Putra dan penerus Wijaya adalah Jayanegara. Pararaton menyebutnya Kala Gemet, yang berarti ""penjahat lemah"". Kira-kira pada suatu waktu dalam kurun pemerintahan Jayanegara, seorang pendeta Italia, Odorico da Pordenone mengunjungi keraton Majapahit di Jawa. Pada tahun 1328, Jayanegara dibunuh oleh tabibnya, Tanca. Ibu tirinya yaitu Gayatri Rajapatni seharusnya menggantikannya, akan tetapi Rajapatni memilih mengundurkan diri dari istana dan menjadi bhiksuni. Rajapatni menunjuk anak perempuannya Tribhuwana Wijayatunggadewi untuk menjadi ratu Majapahit. Pada tahun 1336, Tribhuwana menunjuk Gajah Mada sebagai Mahapatih, pada saat pelantikannya Gajah Mada mengucapkan Sumpah Palapa yang menunjukkan rencananya untuk melebarkan kekuasaan Majapahit dan membangun sebuah kemaharajaan. Selama kekuasaan Tribhuwana, kerajaan Majapahit berkembang menjadi lebih besar dan terkenal di kepulauan Nusantara. Tribhuwana berkuasa di Majapahit sampai kematian ibunya pada tahun 1350. Ia diteruskan oleh putranya, Hayam Wuruk.",82.0,89.0,90.0,87.0
siswa_194,"Majapahit ialah sebuah kerajaan yang berpusat di Jawa Timur, Indonesia, yang pernah berdiri dari sekitar tahun 1293 hingga 1500 M. Kerajaan ini mencapai puncak kejayaannya menjadi kemaharajaan raya yang menguasai wilayah yang luas di Nusantara pada masa kekuasaan Hayam Wuruk, yang berkuasa dari tahun 1350 hingga 1389. Kerajaan Majapahit adalah kerajaan Hindu-Buddha terakhir yang menguasai Nusantara dan dianggap sebagai salah satu dari negara terbesar dalam sejarah Indonesia.[2] Menurut Negarakertagama, kekuasaannya terbentang di Jawa, Sumatra, Semenanjung Malaya, Kalimantan, hingga Indonesia timur, meskipun wilayah kekuasaannya masih diperdebatkan. Sebelum berdirinya Majapahit, Singhasari telah menjadi kerajaan paling kuat di Jawa. Hal ini menjadi perhatian Kubilai Khan, penguasa Dinasti Yuan di Tiongkok. Ia mengirim utusan yang bernama Meng Chi[14] ke Singhasari yang menuntut upeti. Kertanagara, penguasa kerajaan Singhasari yang terakhir menolak untuk membayar upeti dan mempermalukan utusan tersebut dengan merusak wajahnya dan memotong telinganya.[14][15] Kubilai Khan marah dan lalu memberangkatkan ekspedisi besar ke Jawa tahun 1293. Ketika itu, Jayakatwang, adipati Kediri, sudah menggulingkan dan membunuh Kertanegara. Atas saran Aria Wiraraja, Jayakatwang memberikan pengampunan kepada Raden Wijaya, menantu Kertanegara, yang datang menyerahkan diri. Kemudian, Wiraraja mengirim utusan ke Daha, yang membawa surat berisi pernyataan, Raden Wijaya menyerah dan ingin mengabdi kepada Jayakatwang.[16] Jawaban dari surat di atas disambut dengan senang hati.[16] Raden Wijaya kemudian diberi hutan Tarik. Ia membuka hutan itu dan membangun desa baru. Desa itu dinamai Majapahit, yang namanya diambil dari buah maja, dan rasa ""pahit"" dari buah tersebut. Ketika pasukan Mongol tiba, Wijaya bersekutu dengan pasukan Mongol untuk bertempur melawan Jayakatwang. Setelah berhasil menjatuhkan Jayakatwang, Raden Wijaya berbalik menyerang sekutu Mongolnya sehingga memaksa mereka menarik pulang kembali pasukannya secara kalang-kabut karena mereka berada di negeri asing.[17][18] Saat itu juga merupakan kesempatan terakhir mereka untuk menangkap angin muson agar dapat pulang, atau mereka terpaksa harus menunggu enam bulan lagi di pulau yang asing. Tanggal pasti yang digunakan sebagai tanggal kelahiran kerajaan Majapahit adalah hari penobatan Raden Wijaya sebagai raja, yaitu tanggal 15 bulan Kartika tahun 1215 saka yang bertepatan dengan tanggal 10 November 1293. Ia dinobatkan dengan nama resmi Kertarajasa Jayawardhana. Kerajaan ini menghadapi masalah. Beberapa orang terpercaya Kertarajasa, termasuk Ranggalawe, Sora, dan Nambi memberontak melawannya, meskipun pemberontakan tersebut tidak berhasil. Pemberontakan Ranggalawe ini didukung oleh Panji Mahajaya, Ra Arya Sidi, Ra Jaran Waha, Ra Lintang, Ra Tosan, Ra Gelatik, dan Ra Tati. Semua ini tersebut disebutkan dalam Pararaton.[19] Slamet Muljana menduga bahwa mahapatih Halayudha lah yang melakukan konspirasi untuk menjatuhkan semua orang tepercaya raja, agar ia dapat mencapai posisi tertinggi dalam pemerintahan. Namun setelah kematian pemberontak terakhir (Kuti), Halayudha ditangkap dan dipenjara, dan lalu dihukum mati.[18] Wijaya meninggal dunia pada tahun 1309. Putra dan penerus Wijaya adalah Jayanegara. Pararaton menyebutnya Kala Gemet, yang berarti ""penjahat lemah"". Kira-kira pada suatu waktu dalam kurun pemerintahan Jayanegara, seorang pendeta Italia, Odorico da Pordenone mengunjungi keraton Majapahit di Jawa. Pada tahun 1328, Jayanegara dibunuh oleh tabibnya, Tanca. Ibu tirinya yaitu Gayatri Rajapatni seharusnya menggantikannya, akan tetapi Rajapatni memilih mengundurkan diri dari istana dan menjadi bhiksuni. Rajapatni menunjuk anak perempuannya Tribhuwana Wijayatunggadewi untuk menjadi ratu Majapahit. Pada tahun 1336, Tribhuwana menunjuk Gajah Mada sebagai Mahapatih, pada saat pelantikannya Gajah Mada mengucapkan Sumpah Palapa yang menunjukkan rencananya untuk melebarkan kekuasaan Majapahit dan membangun sebuah kemaharajaan. Selama kekuasaan Tribhuwana, kerajaan Majapahit berkembang menjadi lebih besar dan terkenal di kepulauan Nusantara. Tribhuwana berkuasa di Majapahit sampai kematian ibunya pada tahun 1350. Ia diteruskan oleh putranya, Hayam Wuruk.",82.0,89.0,90.0,87.0
