Jawaban Tanpa Negasi Not Token,Manual 1,Manual 2,Manual 3,Rata Manual
1 memperkenalkan nilainilai politik 2 membawa warga negara aktif kegiatan politik 3 komunikasi politik 4 menghimpun aspirasi masyarakat,35.0,50.0,50.0,45.0
1 sarana komunikasi politik 2 sarana sosialisasi politik 3 sarana rekrutmen politik 4 sarana artikulasi kepentingan 5 sarana pengatur konflik,45.0,70.0,50.0,55.0
penyalur aspirasi rakyat pelmilihan presiden,22.0,30.0,25.0,25.666666666666668
mengaspirasikan suara rakyat indonesia,18.0,20.0,25.0,21.0
1cara memperkenalkan nilainilai politik sikapsikap etika politik berlaku dianut negara 2 parpol melayani masyarakat,30.0,36.0,25.0,30.333333333333332
fungsi partai politik sarana komunikasi politikpartai politik menjalankan tugas menyalurkan pendapat aspirasi masyarakat pemerintah,54.0,65.0,50.0,56.333333333333336
partai politik berfungsi sarana menghimpun aspirasi masyarkatserta komunikasi pemerintah,45.0,50.0,50.0,48.333333333333336
fungsi partai politik jembatan fungsi kebijaksanaan pemerintah lapisan masyarakat pemerintah tanggap tuntutan masyarakat,30.0,38.0,25.0,31.0
fungsi partai politik wadah pejabat mempromosikan dimana mengangkat sipejabat,20.0,25.0,25.0,23.333333333333332
fungsi partai politik wadah masyarakat mencalonkan wakil rakyat terpilih wakil masyarakat mengutarakan aspirasi,38.0,44.0,50.0,44.0
partai politik badan membantu pencalonan kepala pemerintahan dewan partai politik membimbing mencalonkan kepala pemerintahan dilantik sesuai keyakinan partai politik,28.0,40.0,25.0,31.0
a pendidikan politik anggota masyarakat luas warga negara indonesia sadar hak kewajibannya kehidupan bermasyarakat berbangsa bernegara b penciptaan iklim kondusif persatuan kesatuan bangsa indonesia kesejahteraan masyarakat c penyerap penghimpun penyalur aspirasi politik masyarakat merumuskan menetapkan kebijakan negara d partisipasi politik warga negara indonesia,43.0,65.0,50.0,52.666666666666664
membantu negara mengatasi politik negeri menjaga kekuasaan stabil negeri,28.0,35.0,25.0,29.333333333333332
fungsi partai politik mengajukan kandidatnya diajukan pemerintahan haqiqi,25.0,33.0,25.0,27.666666666666668
fungsi paratai politik membantu pemerintahan tugastugasnya,25.0,30.0,25.0,26.666666666666668
mengisi kuota kursi dpr pemerintah,10.0,8.0,10.0,9.333333333333334
fungsi sosialisasi politik menilai keputusan tindakannya fungsi mobilisasi politik fungsi partai membawa warga negara kedalam kehidupan publik fungsi refresentasi politik partai politik pemilihan memenangkan suara menempatkan wakilnya parlemen fungsi partisipasi politik dimana tugas partai politik membawa warga negara aktif kegiatan politik,43.0,70.0,50.0,54.333333333333336
1pendidikan politik anggota masyarakat luas mencari warga negara indonesia 2menciptakan iklim kondusif persatuan kesatuan 3menyalurkan aspirasi politik masyarakan luas 4rekruitmen politik proses pengisian jabatan,55.0,65.0,50.0,56.666666666666664
fungsi partai politik stabilisator melaksanakan kepemerintahan kehidupan berbegara partai politik berperan pengambilan keputusan rapart kenegaraan partai politik pondasi negara kegiatan demokrasi sosial politik negara,40.0,55.0,50.0,48.333333333333336
menyejahterakan masyarakat,8.0,10.0,10.0,9.333333333333334
peran mediator konstituennya masyarakat umnya menyalurkan aspirasi suprastruktur politik peran tindakan aktualisasi mengemas aspirasi nyata menyatakannya diharpkan kebijakankebijakan sesuai aspirasi masyarakat bentuk peran mengaktifkan fungsifungsi nyata aksinya aksiaksi partisipasi politik beraneka ragam dimensi intensitansya kegiatan komunikasi politik kampanye menjelang pemilu dll dasar keterkaitan fungsi peran pendapat membedakan peran fungsi parpol menyatukannya rangkaian terpisahkan,35.0,60.0,50.0,48.333333333333336
jembatan fungsi kebijaksanaan pemerintah lapisan masyarakat pemerintah tanggap tuntutan masyarakat media perantara rakyat pemerintah fungsi dilaksanakan mendengarkan menggabungkan merumuskan aspirasi berasal masyarakat dituangkan bentuk program partai perumusan bentuk program mencerminkan inti aspirasi berasal masyarakat diperjuangkan proses pembuatan kebijaksanaan fungsi terlaksana akibatnya aspirasi kepentingan masyarakat hilang memunculkan konflik kepentingan masyarakat pemerintah partai politik penyalur aspirasi masyarakat,40.0,58.0,50.0,49.333333333333336
partai politik organisasi mengusung calon wakil rakyat partai masingmasing,20.0,20.0,25.0,21.666666666666668
fungsi partai politik pemerintahan mempermudah jalannya pemerintahan dimana partai politik diharapkan perbedaan pendapat perwakilan masingmasing partai politik mudah mengenalinya sesuai tujuan misi visi masingmasing partai politik,35.0,48.0,50.0,44.333333333333336
fungsi partai politik perwakilan rakyat pelaksana tugas tugas pemerintahan didalam pemerintahan konteks keuasaan pemerintahan partai politik pendukung pemerintahan partai politik partai politik partai memiliki hak kewajiban pemerintahan pendukung pemerintahan,30.0,45.0,50.0,41.666666666666664
bertanggung mengelola menyejahterakan masyarakat,10.0,10.0,10.0,10.0
partai politik terpilih pemilu bertanggung mengelola menyejahterakan golongan masyarakat menjaga tatanan aparatur negara sesuai perundangundangan berlaku,23.0,30.0,25.0,26.0
fungsinya orang jujur fungsi negara berjalan,10.0,5.0,10.0,8.333333333333334
partai politik organisasi ketatanegaraan pemerintahan partai politik sarana menampung aspirasi rakyat meanmpung permasalahan negeri sarana wakil rakyat,40.0,45.0,50.0,45.0
mencari calon pemimpin berkualitas,5.0,5.0,10.0,6.666666666666667
mencari mempertahankan kekuasaan melaksanakan mewujudkan program program susun sesuai ideologi,28.0,34.0,25.0,29.0
fungsi partai politik berkaitan kekuasaan pemerintahan mengatur kekuasaan pemerintahan,35.0,40.0,50.0,41.666666666666664
1 politik jembatan masyarakat pemerintah 2 politik penampung aspirasai masyarakat,38.0,45.0,50.0,44.333333333333336
fungsi partai politik penjembatan masyarakat pemerintah dimana anggota partai politik berasal masyarakat dikader calon pemimpin negara berkedudukan pemerintahan pusat daerah politik berfungsi taktik mengatur masyarakat pemerintahan,44.0,55.0,50.0,49.666666666666664
partai politik berfungsi sarana pendidikan politik anggota masyarakat luas penciptaan suasana kondusif persatuan kesatuan bangsa indonesia kesejahteraan masyarakat sarana partisipasi politik warga negara indonesia rekrutmen politik proses pengisian jabatan politik mekanisme demokrasi memperhatikan kesetaraan keadilan gender,36.0,50.0,50.0,45.333333333333336
partai politik berfungsi sarana politik masyarakat anggotanya mewakili suara masyarakat pemerintahan partai politik negara solusi permasalahan negara,30.0,40.0,50.0,40.0
sarana masyarakat membangun negara pemerintahan,18.0,25.0,25.0,22.666666666666668
partai politik organisasi bersifat nasional dab dibentuk sekelompok warga indonesia sukarela dasar kesamaan kehendak cita cita negara,25.0,33.0,25.0,27.666666666666668
partai politik sarana komunikasi politik partai politik menjalankan tugas menyalurkan pendapat aspirasi masyarakat pemerintah mengumpulkan samua pendapat aspirasiaspirasi masyarakat diseleksi diserahkan pemerintah,42.0,56.0,50.0,49.333333333333336
partai politik lahan mencari kekuasaan terkadang memperkaya partai politik 40 serius mensejahterakan masyarakat berhasil politikus lupa janji masyarakat,48.0,67.0,50.0,55.0
fungsi partai politik pendukung pemerintah menangani negara,30.0,36.0,25.0,30.333333333333332
fungsi partai politik kekuasaan pemerintahan mengatur negara kemasa menajdi negara maju,39.0,44.0,50.0,44.333333333333336
berkumpulnya anggota ploitik,5.0,5.0,10.0,6.666666666666667
partai politik berfungsi media pendukung jembatan pemerintahan rakyat,20.0,20.0,25.0,21.666666666666668
fungsi partai politik pemerintahan wadah warga negara aspirasi pendapat ikatan partai partai politik berguna membantu pemilihan kepala daerah presiden,38.0,44.0,50.0,44.0
tiang penegak negera,5.0,5.0,10.0,6.666666666666667
menyatukan kebersamaan masyarakat,10.0,7.0,10.0,9.0
partai politik jembatan memasuki pemerintahan tiang pemerintahan,18.0,15.0,25.0,19.333333333333332
partai politik calon pemilik kursi pemilu partai politik nama kalangan masyarakat calon legislatif berkualitas menutup partai politik nama wakil rakyat,30.0,38.0,25.0,31.0
partai politik wadah aspirasi masyarakat menyalurkan caloncalon pemimpin kepemimpinan negara mengusung caloncalon pemimpin bangsa pemilihan kampanye partai politik terpilih bibit individual usung calon pemimpin,28.0,34.0,25.0,29.0
1 fungsi partai politik wadah masyarakat berpolitik berdemokrasi sistem pemerintahan tolak ukur keberhasilan politik sistem pemerintahan,28.0,30.0,25.0,27.666666666666668
sarana pendidikan politik anggota masyarakat luas warga negara indonesia sadar hak kewajibannya kehidupan bermasyarakat berbangsa bernegara penyerap penghimpun penyalur aspirasi politik masyarakat merumuskan menetapkan kebijakan negara menciptaan iklim kondusif persatuan kesatuan bangsa indonesia kesejahteraan masyarakat,48.0,57.0,50.0,51.666666666666664
partai politik kekuasaan dibawah presiden,10.0,10.0,10.0,10.0
pemerintahan,5.0,5.0,10.0,6.666666666666667
