Jawaban Tanpa Negasi Not Token,Manual 1,Manual 2,Manual 3,Rata Manual
1 memperhatikan uang dompet 2 membeli barang 3 mencatat barangbarang beli 4 membeli barang harga murah 5 penjual 6 menghindari rame,30.0,35.0,25.0,30.0
1 beli butuhkan 2 berfikir bijak 3 anggaran belanja 4 membeli barang 5 mencari harga sesuai kondisi barang 6 mencatat barang dibeli,45.0,55.0,50.0,50.0
1 mencatat list barang beli 2 budget 3 pilih departement store harga murah 4 sesuaikan belanjaan kebutuhan 5 belanjalah orang 6 siapkan uang ekstra kebutuhan dugaan,40.0,50.0,50.0,46.666666666666664
membeli murah daftar belanjaan mengajak orang bijak hidup irit lurus,30.0,25.0,25.0,26.666666666666668
mencari departement store mengadakan diskon belanja benarbenar membutuhkan barang dibeli belanja murah kualitas bagus berbelanja barang barang dibutuhkan mengutamakan kebutuhan dibandingkan berbelanja mudah tergoda aneka barang dibutuhkan,60.0,45.0,50.0,51.666666666666664
menghabiskan uang barangbelanjalah diskonbelanja direncanakan belanja sajahematjangan belanja tergantung toko,35.0,30.0,25.0,30.0
menghabiskan uang barangbelanjalah diskonbelanja direncanakan belanja sajahematjangan belanja tergantung toko,35.0,30.0,25.0,30.0
belanja perut kenyang membawa daftar belanja membeli berdasarkan kebutuhan membeli harga murah berkualitas membawa kantong plastik belanja berdasar nafsu pribadi,40.0,35.0,50.0,41.666666666666664
membawa daftar belanjaan belanja perut kenyang belanja diskon pilih mall dijamin mahal berusaha lapar mata belanja orang hemat,38.0,35.0,25.0,32.666666666666664
1buatlah list barang beli letakkan daftar barang primer butuhkan kebutuhan sekunder 2kalau memiliki anak utamakan kebutuhan anak susu popok bayi buah hati 3bandingkan komposisi kualitas kuantitas barang beli malu menghabiskan detik rak membandingkan mudah tergiur barangbarang diskon hitunglah keuangan teliti sesuaikan kebutuhan 4anda stok barang rumah harga barang miring tempatkan barang list belanja memiliki budget ya ambil barang ladies 5pilihlah barang dibeli grosir eceran pilihlah sesuai usia pemakaian barang membeli barang kebutuhan mubazir terpakai 6selalu bawa catatan bolpen samping harga barang beli menghindari kecurangan toko budget keluarkan,88.0,95.0,90.0,91.0
meneliti dibutuhkan,8.0,5.0,10.0,7.666666666666667
1 cari dibutuhkan 2 cari lengkap 3 cari harganya murah 4 cari alternatif 5 cari toko 6 cari kota,15.0,24.0,25.0,21.333333333333332
1 belanja online bukalapakcom 2 belanja online tokopediacom 3 belanja online lazadacom 4 belanja menyertakan perantara 5 disuruh transfer 6 pastikan penjual memiliki info pribadi lengkap,12.0,8.0,10.0,10.0
belanja lazadatokopediamempertimbangkan harga,10.0,8.0,10.0,9.333333333333334
membawa uang usahakan uang cash membeli dibutuhkan cari murah cari pasar loak,14.0,15.0,10.0,13.0
membawa kantong keresek membeli sesuai kebutuhan membeli barang murah,16.0,10.0,10.0,12.0
membeli diskonan membeli membeli membeli sesuai keuangan membeli pasar,18.0,15.0,10.0,14.333333333333334
harga budget membeli barang pasar loak tanggal kadaluarsa,20.0,15.0,10.0,15.0
daftar hargamenghitung budgetmemperhitungkan jarak tempumemperhitungkan tempuhtawar menawarlihat tangga kadaluarsa,22.0,18.0,25.0,21.666666666666668
1 meninimalis uang 2 menahan barang 3 belanja 4 cari harga murah kualitas 5 mencari diskon 6 hemat,30.0,25.0,25.0,26.666666666666668
shooping online recomended,10.0,5.0,10.0,8.333333333333334
belanja pasar belanja toko belanja online belanja swalayan belanja alfamart belanja indomart,12.0,8.0,10.0,10.0
1 belanja butuhkan 2 belanja 3 manfaatkan diskon mall 4 hemat 5 memilih harga murah 7 memilih malltoko rumah,28.0,25.0,25.0,26.0
shooping online cari diskonan,10.0,5.0,10.0,8.333333333333334
buatlah list barang beli letakkan daftar barang primer butuhkan kebutuhan sekunder memiliki anak utamakan kebutuhan anak susu popok bayi buah hati bandingkan komposisi kualitas kuantitas barang beli malu menghabiskan detik rak membandingkan mudah tergiur barangbarang diskon hitunglah keuangan teliti sesuaikan kebutuhan stok barang rumah harga barang miring tempatkan barang list belanja memiliki budget ya ambil barang ladies pilihlah barang dibeli grosir eceran pilihlah sesuai usia pemakaian barang membeli barang kebutuhan mubazir terpakai bawa catatan bolpen samping harga barang beli menghindari kecurangan toko budget keluarkan,70.0,55.0,80.0,68.33333333333333
list barang belanjaan mengutamakan kebutuhan premier membandingkan kualitas barang memutuskan membeli mudah tergiur barangbarang diskon lihat harga barang sesuai budget,50.0,40.0,50.0,46.666666666666664
list barang belanjaan langsung barang memanage uang belanja melihatlihat barang list mengecek barang dibeli sesuai list menghitung ulang barang dibeli,35.0,35.0,25.0,31.666666666666668
list daftar barang belanja mebawa uang memilih harga mahal murahan mengecek ulang barang belanja dibayar belanja terpercaya memilih barang kualitasnya bagus bermutu,40.0,32.0,50.0,40.666666666666664
sesuai kebutuhan lihat harga lihat kualitas barang budget mencari yg murah,28.0,25.0,25.0,26.0
belanja sesuai kebutuhan belanja sesuai budget cari nyaman cari murah hindari belanja pilih barang kualitas bagus,47.0,29.0,50.0,42.0
eshopping teman bagus belanja cari internet barang dibutuhkan,19.0,15.0,25.0,19.666666666666668
cari barang harga terjangkau berkualitas dibutuhkan awet mudah rusak kredit keberatan mengambil cicilan sesuai kegunaan,42.0,40.0,50.0,44.0
memilih barang sesuai kebutuhan,18.0,10.0,10.0,12.666666666666666
barang butuhkan mencari referensi barang membeli uang belanja sesuai kebutuhan membandingkan barang toko waspada penipuan cek kondisi barang beli,41.0,31.0,50.0,40.666666666666664
belanja online belanja kartu atm belanja kartu kredit belanja sesuai kebutuhan belanja barang halal belanja toko terpercaya resmi,17.0,20.0,25.0,20.666666666666668
melist barang belanjaan mengemat kebutuhan keinginana,22.0,20.0,25.0,22.333333333333332
6 belanja efektif membawa uang mencatat kebutuhan dibeli mencari barang diskon mudah tergoda diskon skala prioritas tanggungan dipenuhi,32.0,25.0,25.0,27.333333333333332
membawa daftar belanja menentukan barang pokok wajib dibeli membawa uang ek tanggal kadaluarsa membandingkan kegunaan kedepan cari barang diskon,38.0,28.0,25.0,30.333333333333332
belanja list barang beli cari barang murah berkualitas cari diskon terpengaruh bujukan spg cari beli 2 gratis 1,40.0,25.0,50.0,38.333333333333336
daftar belanja bawa budget pas sesuai kebutuhan hindari pembayaran kartu kredit debit disiplin daftar belanja langsung pulang belanja catat pengeluaran belanja,36.0,37.0,25.0,32.666666666666664
daftar belanjaanbandingkan membelijangan mudah tergiur diskoncerdas memilih ukuran produkselalu membawa daftar belanjaanmembawa uang,40.0,35.0,25.0,33.333333333333336
buatlah list barang beli letakkan daftar barang primer butuhkan kebutuhan sekunder memiliki anak utamakan kebutuhan anak susu popok bayi buah hati bandingkan komposisi kualitas kuantitas barang beli mudah tergiur barangbarang diskon pilihlah barang dibeli grosir eceran bawa catatan bolpen samping harga barang beli,70.0,60.0,75.0,68.33333333333333
buatlah list barang beli memiliki anak utamakan kebutuhan anak bandingkan komposisi kualitas kuantitas barang beli mudah tergiur barangbarang diskon pilihlah barang dibeli grosir eceran bawa catatan bolpen samping harga barang beli,80.0,65.0,75.0,73.33333333333333
buatlah list barang beli memiliki anak utamakan kebutuhan anak bandingkan komposisi kualitas kuantitas barang beli mudah tergiur barangbarang diskon pilihlah barang dibeli grosir eceran bawa catatan bolpen samping,74.0,65.0,75.0,71.33333333333333
pilih barang sesuai kebutuhan cek barang beli cek kadaluarsa barang hindari belanja online mengerti beli barang sesuai uang dibawa hindari membeli barang terburuburu,47.0,38.0,50.0,45.0
membawa uang bawalah buatlah daftar barang beli mudah toko langsung cari barang dibutuhkan carilah barang beli gratis carilah toko diskon indomret card gunakanlah murah,38.0,45.0,50.0,44.333333333333336
tentukan daftar belanja sedia uang belanja tentukan belanja tentukan belanja perhitungkan harga belanja,27.0,30.0,25.0,27.333333333333332
memiih barang sesuai memilih barang berdasarkan uang dimiliki memilih kualitas barang mengerti merek harganya bersahabatmemilih sesuai menjadwalkan barang beli debelum pusat perbelanjaan,37.0,28.0,25.0,30.0
list barang dibeli memperhitungkan total pengeluaran mentarget pengeluaran mencari barang berdiskon membeli barang dibutuhkan bergaransi,30.0,25.0,25.0,26.666666666666668
kepasar cari yg murah beli barang yg harga mahal tinggal tawar menawar beli uang belanja,25.0,23.0,25.0,24.333333333333332
daftar belanjaan membeli barang berguna membawa uang pas memilih barang,22.0,20.0,25.0,22.333333333333332
membawa uang list barang dibeli berbelanja lihat tujuannya,25.0,24.0,25.0,24.666666666666668
sesuai kebutuhan boros membawa kantong utamakan prioritas utama,18.0,15.0,25.0,19.333333333333332
memikirkan budget pilih diperlukanbutuh lokasi strategis,10.0,10.0,10.0,10.0
boros membeli halhal merencanakan membeli buangbuang,21.0,15.0,25.0,20.333333333333332
1 memilih barang yg terbaik 2 pintar menawar pasar tradisional 3 tas belanja 4 belanja pagi sore 5 membawa uang yg 6 membawa atm,18.0,25.0,25.0,22.666666666666668
tawar menawar beli beli murah berkualitas beli mahal beli keperluan hindari rayuan pedagang,30.0,20.0,25.0,25.0
