Jawaban tanpa Punctuation,Manual 1,Manual 2,Manual 3,Rata Manual
masyarakat madani adalah masyarakt yang beradap  menjunjung tinggi nilainilai kemanusiaan yang maju dalam penguasaan ilmu pengetahuan dan teknologi ,90.0,100.0,90.0,93.33333333333333
masyarakat madani adlah masyarakat yang beradab menjunjung tinggi nilai kemanusiaan yang maju dalam ilmu pengetahuan dan teknologi ,86.0,100.0,90.0,92.0
masyarakat yang masih terdapat pada suku pendalaman ,5.0,0.0,10.0,5.0
masyarakat madani merupakan masyarakat yang beradab menjunjung tinggi nilai kemanusiaan maju dalam ilmu pengetahuan dan teknologi ,90.0,100.0,90.0,93.33333333333333
masyarakat kuno ,5.0,0.0,10.0,5.0
masyarakat madani adalah kelembagaan sosial yang melindungi warga negara dari perwujudkan kekuasaan negara yang berlebihan masyarakat madani merupakan tiang utama dalam kehidupan politik berdemokratis wajib bagi setiap masyarakat madani yang tidak hanya melindungi warga negara dalam berhadapan dengan negara namun masyarakat madani juga dapat merumuskan dan menyuarakan aspirasi masyarakat ,20.0,25.0,25.0,23.333333333333332
masyarakat yang makmur dan sejahtera dalam bidang ekonomi maupun politik ,10.0,15.0,10.0,11.666666666666666
masyarakat madani dalam bahasa inggris civil society dapat diartikan sebagai suatu masyarakat yang beradab dalam membangun menjalani dan mamaknai kehidupannya kata madani sendiri berasal dari bahasa inggris yang artinya civil atau civilized beradab istilah masyarakat madani adalah terjemahan dari civil atau civilized society yang berarti masyarakat yang berperadaban untuk pertama kali istilah masyarakat madani dimunculkan oleh anwar ibrahim mantan wakil perdana menteri malaysia menurut anwar ibrahim masyarakat madani merupakan sistem sosial yang subur berdasarkan prinsip moral yang menjamin keseimbangan antara kebebasan individu dengan kestabilan masyarakat inisiatif dari individu dan masyarakat akan berupa pemikiran seni pelaksanaan pemerintah yang berdasarkan undangundang dan bukan nafsu atau keinginan individu ,30.0,25.0,25.0,26.666666666666668
masyarakat madani dapat diartikan sebagai suatu masyarakat yang beradab dalam membangun menjalani dan mamaknai kehidupannya ,40.0,50.0,50.0,46.666666666666664
masyarakat madani adalah kelembagaan sosial yang melindungi warga negara dari perwujudkan kekuasaan negara yang berlebihan masyarakat madani merupakan tiang utama dalam kehidupan politik berdemokratis wajib bagi setiap masyarakat madani yang tidak hanya melindungi warga negara dalam berhadapan dengan negara namun masyarakat madani juga dapat merumuskan dan menyuarakan aspirasi masyarakat ,43.0,45.0,50.0,46.0
masyarakat madani adalah masyarakat yang makmur dan damai serta bisa memenuhi kebutuhanya sendiri ,28.0,15.0,25.0,22.666666666666668
masyarakat madani dalam bahasa inggris civil society dapat diartikan sebagai suatu masyarakat yang beradab dalam membangun menjalani dan mamaknai kehidupannya1 kata madani sendiri berasal dari bahasa inggris yang artinya civil atau civilized beradab1 istilah masyarakat madani adalah terjemahan dari civil atau civilized society yang berarti masyarakat yang berperadaban1 untuk pertama kali istilah masyarakat madani dimunculkan oleh anwar ibrahim mantan wakil perdana menteri malaysia2 menurut anwar ibrahim masyarakat madani merupakan sistem sosial yang subur berdasarkan prinsip moral yang menjamin keseimbangan antara kebebasan individu dengan kestabilan masyarakat2 inisiatif dari individu dan masyarakat akan berupa pemikiran seni pelaksanaan pemerintah yang berdasarkan undangundang dan bukan nafsu atau keinginan individu 2 dawam rahardjo mendefinisikan masyarakat madani sebagai proses penciptaan peradaban yang mengacu kepada nilainilai kebijakan bersama2 dawam menjelaskan dasar utama dari masyarakat madani adalah persatuan dan integrasi sosial yang didasarkan pada suatu pedoman hidup menghindarkan diri dari konflik dan permusuhan yang menyebabkan perpecahan dan hidup dalam suatu persaudaraan2 masyarakat madani pada prinsipnya memiliki multimakna yaitu masyarakat yang demokratis menjunjung tinggi etika dan moralitas transparan toleransi berpotensi aspiratif bermotivasi berpartisipasi konsisten memiliki bandingan mampu berkoordinasi sederhana sinkron integral mengakui emansipasi dan hak asasi namun yang paling dominan adalah masyarakat yang demokratis3 masyarakat madani adalah kelembagaan sosial yang akan melindungi warga negara dari perwujudan kekuasaan negara yang berlebihan4 bahkan masyarakat madani tiang utama kehidupan politik yang demokratis4 sebab masyarakat madani tidak saja melindungi warga negara dalam berhadapan dengan negara tetapi juga merumuskan dan menyuarakan aspirasi masyarakat ,50.0,80.0,75.0,68.33333333333333
masyarakat yang kaku dan lebih sulit untuk diatur untuk mengikuti zaman yang modern masih belum ada keinginan untuk hal itu ,10.0,15.0,10.0,11.666666666666666
masyarakat madani dalam bahasa inggris civil society dapat diartikan sebagai suatu masyarakat yang beradab dalam membangun menjalani dan mamaknai kehidupannya ,40.0,65.0,50.0,51.666666666666664
suatu masyarakat yang beradab dalam membangun menjalani dan mamaknai kehidupannya ,44.0,50.0,50.0,48.0
masyarakat madani adalah masyarakat yang bertujuan untuk mensejahterakan kelompoknya ,30.0,15.0,25.0,23.333333333333332
kelembagaan sosial yang melindungi warga negara dari perwujudkan kekuasaan negara yang berlebihan masyarakat madani merupakan tiang utama dalam kehidupan politik berdemokratis ,28.0,15.0,25.0,22.666666666666668
masyarakat yang beradab dalam membangun menjalani dan memaknai kehidupannya ,44.0,25.0,50.0,39.666666666666664
masyarakat madani adalah suatu masyarakat yang beradab dalam membangun menjalani dan memaknai kehidupan ,40.0,50.0,50.0,46.666666666666664
masyarakat kuno ,5.0,0.0,10.0,5.0
masyarakat madani dalam bahasa inggris civil society dapat diartikan sebagai suatu masyarakat yang beradab dalam membangun menjalani dan mamaknai kehidupannya1 kata madani sendiri berasal dari bahasa inggris yang artinya civil atau civilized beradab1 istilah masyarakat madani adalah terjemahan dari civil atau civilized society yang berarti masyarakat yang berperadaban1 untuk pertama kali istilah masyarakat madani dimunculkan oleh anwar ibrahim mantan wakil perdana menteri malaysia2 menurut anwar ibrahim masyarakat madani merupakan sistem sosial yang subur berdasarkan prinsip moral yang menjamin keseimbangan antara kebebasan individu dengan kestabilan masyarakat2 inisiatif dari individu dan masyarakat akan berupa pemikiran seni pelaksanaan pemerintah yang berdasarkan undangundang dan bukan nafsu atau keinginan individu ,40.0,80.0,75.0,65.0
masyarakat yang beradab dalam membangun menjalani dan mamaknai kehidupannya kata madani sendiri berasal dari bahasa inggris yang artinya civil atau civilized  untuk pertama kali istilah masyarakat madani dimunculkan oleh anwar ibrahim mantan wakil perdana menteri malaysia unsurunsur masyarakat madani adalah adanya wilayah publik yang luas demokrasi  toleransi  pluralisme ciriciri masyarakat madani adalah 1 terintegrasinya individu  individu dan kelompok  kelompok eksklusif ke dalam masyarakat melalui kontrak sosial dan aliansi sosial 2 menyebarnya kekuasaan sehingga kepentingan  kepentingan yang mendominasi dalam masyarakat dapat dikurangi oleh kekuatan  kekuatan alternatif 3 terjembataninya kepentingan  kepentingan individu dan negara karena keanggotaan organisasi  organisasi volunter mampu memberikan masukan  masukan terhadap keputusan  keputusan pemerintah 4 meluasnya kesetiaan loyalty dan kepercayaan trust sehingga individu  individu mengakui keterkaitannya dengan orang lain dan tidak mementingkan diri sendiri individualis 5 adanya pembebasan masyarakat melalui kegiatan lembaga  lembaga sosial dengan berbagai perspektif ,40.0,45.0,50.0,45.0
masyarakat beradab dalam membangun menjalani dalam memaknai kehidupan ,44.0,40.0,50.0,44.666666666666664
masyarakat madani adalah masyarakat yang telah mencapai keberadaannya dalam hal melakukan pembagunan pemaknaan dan penjalanan kehidupannya sendiri masyarakat madani juga dapat disebut sebagai masyarakat yang telah mencapai kebebasan dan kesejahteraannya ,48.0,0.0,50.0,32.666666666666664
masyarakat madani merupakan masyarakat yang sadar akan hak dan kewajiban sebagai warga indonesia dimana masyarakat madani merupakan masyarakat yang telah maju dan atau berkembang dalam pola pikir masyarakat madani juga mengerti akan perannya sebagai bela negara di era ini masyarakat madani hanya sedikit yang berkembang disekitar kita ,30.0,40.0,50.0,40.0
suatu masyarakat yang beradab dalam membangun menjalani dan memaknai kehidupannya ,38.0,40.0,50.0,42.666666666666664
masyarakat madani adalah suatu masyarakat yang beradab dalam membangun menjalani dan memaknai kehidupannya ,44.0,40.0,50.0,44.666666666666664
masyarakat yang sudah dapat memenuhi kebutuhan sehari hari dan dapat membantu lainya dengan hati yang iklas ,29.0,10.0,25.0,21.333333333333332
masyarakat madani  masyarakat yang menjunjung nilai nilai norma hukum yang ditopang oleh iman ilmu dan peradaban teknologi ,38.0,37.0,25.0,33.333333333333336
masyarakat yang berpradaban ,5.0,0.0,10.0,5.0
masyarakat madani adalah proses penciptaan peradaban yang mengacu kepada nilai  nilai kebijakan bersama ,50.0,40.0,50.0,46.666666666666664
masyarakat madani adalah sebuah masyarakat yang di dalamnya terdapat peraturan sesuai norma yang berlaku ,33.0,30.0,25.0,29.333333333333332
masyarakat yang sudah memiliki orientasi kedepan yang dapat merubah kehidupan menjadi lebih baik ,44.0,30.0,50.0,41.333333333333336
masyarakat madani adalah msyarakat yang modern tetapi masih memegang teguh agama atau keyakinan yang dianut ,20.0,15.0,25.0,20.0
masyarakat madani adalah masyarakat yang beradab dalam membangun menjalani dan memaknai kehidupannya ,44.0,40.0,50.0,44.666666666666664
masyarakat madani adalah masyarakat yang beradab dalam hal membangun menjalani dan memaknai kehidupannya ,44.0,40.0,50.0,44.666666666666664
masyarakat madani adalah masyarakat yang beradab menjunjung tinggi nilai nilai kemanusian yang maju dalam penguasaan ilmu pengetahuan dan teknologi ,100.0,100.0,100.0,100.0
sistem sosial yang subur berdasarkan prinsip moral yang menjamin keseimbangan antara kebebasan individu dengan kestabilan masyarakatinisiatif dari individu dan masyarakat akan berupa pemikiran seni pelaksanaan pemerintah yang berdasarkan undangundang dan bukan nafsu atau keinginan individu ,20.0,15.0,25.0,20.0
masyarakat madani adalah kelembagaan sosial yang akan melindungi warga negara dari perwujudan kekuasaan negara yang berlebihan bahkan masyarakat madani tiang utama kehidupan politik yang demokratis sebab masyarakat madani tidak saja melindungi warga negara dalam berhadapan dengan negara tetapi juga merumuskan dan menyuarakan aspirasi masyarakat ,30.0,30.0,25.0,28.333333333333332
masyarakat madani adalah sebagai suatu masyarakat yang beradab dalam membangun menjalani dan mamaknai kehidupannya ,44.0,40.0,50.0,44.666666666666664
sebuah gagasan yang menggambarkan maasyarakat beradab yang mengacu pada nilainilai kebajikan dengan mengembangkan dan menerapkan prinsipprinsip interaksi sosial yang kondusif bagi peneiptaan tatanan demokratis dalam kehidupan bermasyarakat dan bernegara ,32.0,25.0,25.0,27.333333333333332
masyarakat yang menganut agama tertentu ,5.0,0.0,10.0,5.0
masyarakat madani adalah sebutan untuk orang dari ras teertentu dan agama atau kepercayaan tertentu ,10.0,0.0,10.0,6.666666666666667
masyarakat madani adalah masyarakat yang sejahtera baik di lingkungan keluarga dan umum ,20.0,10.0,10.0,13.333333333333334
masyarakat madani adalah masyarakat yang beradab dalam membangun menjalani dan memaknai hidupnya  dan masyarakat madani juga merupakaan kelembagaan sosial yang melindungi warganya dari perwujudan kekuasaan negara yang berlebihan ,38.0,40.0,50.0,42.666666666666664
masyarakat madani ialah masyarakat yang menjunjung tinggi nilai  nilai peradaban ,40.0,30.0,50.0,40.0
sebuah gagasan yang menggambarkan maasyarakat beradab yang mengacu pada nilainilai kebajikan ,20.0,25.0,25.0,23.333333333333332
masyarakat madani adalah masyarakat yang menjujung tinggi musyawarah dalam menyelesaikan segala sesuatu ,24.0,25.0,25.0,24.666666666666668
masyarakat yang menjunjung tinggi mufakat ,38.0,15.0,25.0,26.0
masyarakat madani adalah kumpulan atau kelompok dari masyarakat yang beradap berkembang dan menumbuhkan sikap mandiri serta mampu memecahkan masalah secara kekeluargaan dan harmonis ,29.0,25.0,25.0,26.333333333333332
masyarakat madani adalah masyarakat yang memaknai kehidupannya dalam beradab membangun mengelola mengembang kehidupannya ,30.0,25.0,25.0,26.666666666666668
masyarakat yang demokratis dan menghargai human dignity atau hakhak tanggung jawab manusia ,16.0,25.0,25.0,22.0
masyarakat pada zaman batu ,0.0,0.0,0.0,1.0
masyarakat madari adalah masyarakat yang menjunjung nilai kemanusiaan keadilan dan kesejahteraan ,36.0,25.0,25.0,28.666666666666668
