Jawaban tanpa Punctuation,Manual 1,Manual 2,Manual 3,Rata Manual
parkour adalah seni bergerak dan metode latihan natural yang bertujuan untuk membantu manusia bergerak dengan cepat dan eficien parkour mengunakan beberapa gerakan seperti berlari memanjat meloncat untuk melatih kemampuan manusia untuk melewati segala bentuk rintangan di berbagai situasi dan kondisi di lingkungan urban atau rural ,40.0,43.0,50.0,44.333333333333336
parkour adalah aktivitas yang bertujuan untuk berpindah dari satu tempat ke tempat lainnya dengan efisien dan secepatcepatnya menggunakan prinsip kemampuan badan manusia itu berarti untuk menolong seseorang melintasi rintangan yang bisa berupa apa saja di sekitar lingkungan dari cabangcabang pohon dan batubatuan hingga pegangan tangan dan tembok beton yang bisa dilatih di desa dan di kota ,50.0,55.0,50.0,51.666666666666664
keindahan dan kelenturan dalam melewati rintangan biasanya yang di pakai di gedung bertingkat ,18.0,20.0,25.0,21.0
parkour adalah aktivitas yang bertujuan untuk berpindah dari satu tempat ke tempat lainnya dengan efisien dan secepatcepatnya menggunakan prinsip kemampuan badan manusia ,50.0,43.0,50.0,47.666666666666664
loncat loncat di gedung ,18.0,5.0,10.0,11.0
parkour atau seni gerak adalah aktivitas yang bertujuan untuk berpindah dari satu tempat ke tempat lainnya dengan efisien dan secepatcepatnya menggunakan prinsip kemampuan badan manusia itu berarti untuk menolong seseorang melintasi rintangan yang bisa berupa apa saja di sekitar lingkungan dari cabangcabang pohon dan batubatuan hingga pegangan tangan dan tembok beton yang bisa dilatih di desa dan di kota ,48.0,50.0,50.0,49.333333333333336
parkour adalah aktivitas dengan tujuan berpindah dari satu tempat ke tempat lain dengan cepat dan efisien menggunakan prinsip kemampuan badan manusia ,50.0,43.0,50.0,47.666666666666664
parkour adalah seni bergerak dan metode latihan natural yang bertujuan untuk membantu manusia bergerak dengan cepat dan eficien parkour mengunakan beberapa gerakan seperti berlari memanjat meloncat untuk melatih kemampuan manusia untuk melewati segala bentuk rintangan di berbagai situasi dan kondisi di lingkungan urban atau rural ,40.0,43.0,50.0,44.333333333333336
parkour kadangkadang disingkat pk atau seni gerak adalah aktivitas yang bertujuan untuk berpindah dari satu tempat ke tempat lainnya dengan efisien dan secepatcepatnya menggunakan prinsip kemampuan badan manusia itu berarti untuk menolong seseorang melintasi rintangan yang bisa berupa apa saja di sekitar lingkungan dari cabangcabang pohon dan batubatuan hingga pegangan tangan dan tembok beton yang bisa dilatih di desa dan di kota ,48.0,50.0,50.0,49.333333333333336
parkour seni gerak adalah aktivitas yang bertujuan untuk berpindah dari satu tempat ke tempat lainnya dengan efisien dan secepatcepatnya menggunakan prinsip kemampuan badan manusia itu berarti untuk menolong seseorang melintasi rintangan yang bisa berupa apa saja di sekitar lingkungan dari cabangcabang pohon dan batubatuan hingga pegangan tangan dan tembok beton yang bisa dilatih di desa dan di kota ,48.0,50.0,50.0,49.333333333333336
parkour adalah aktivitas yang bertujuan untuk berpindah dari satu tempat ke tempat lainnya dengan efisien dan secepatcepatnya menggunakan prinsip kemampuan badan manusia itu berarti untuk menolong seseorang melintasi rintangan yang bisa berupa apa saja di sekitar lingkungan dari cabangcabang pohon dan batubatuan hingga pegangan tangan dan tembok beton yang bisa dilatih di desa dan di kota ,48.0,50.0,50.0,49.333333333333336
olahraga lompatlompat ,20.0,10.0,25.0,18.333333333333332
parkour adalah kegiatan locat dari dinding ke dinding ,28.0,25.0,25.0,26.0
olahraga yang mementingkan keindahan lompat dan panjat biasanya bekerjanya di alam liar dan gedung kosong ,30.0,60.0,50.0,46.666666666666664
parkour adalah seni gerak yang dilakukan oleh seorang profesioanl dimana seni ini melakukan teknik lari sambil melintasi berbagai rintangan seperti melewati gedung  gedung atau tempat tinggi ke tempat rendah ,38.0,60.0,50.0,49.333333333333336
olahraga yang mengandalkan pergerakan tubuh dengan menggunakan tangan dan kaki  tempat biasa melakukan parkour adalah bagianbagian gedung yang tinggi dan rendah ,40.0,60.0,50.0,50.0
aktivitas yang bertujuan untuk berpindah dari satu tempat ke tempat lainnya dengan efisien dan secepatcepatnya menggunakan prinsip kemampuan badan manusia itu berarti untuk menolong seseorang melintasi rintangan yang bisa berupa apa saja di sekitar lingkungan dari cabangcabang pohon dan batubatuan hingga pegangan tangan dan tembok beton yang bisa dilatih di desa dan di kota ,48.0,65.0,50.0,54.333333333333336
parkour mengunakan beberapa gerakan seperti berlari memanjat meloncat untuk melatih kemampuan manusia untuk melewati segala bentuk rintangan di berbagai situasi dan kondisi di lingkungan urban atau rural tempat yang biasa atau dapat melakukan parkour adalah taman gedung bertingkat ,40.0,50.0,50.0,46.666666666666664
pakour adalah olahraga serba guna yang akan membantu anda bergerak memanjat meloncat dan anda tidak akan terus terhalang akan tembok atau rintangan yang menghalau anda untuk maju ke depan yang saya tahu dimana saja bisa terkadang bisa juga di atas gedung ,30.0,40.0,50.0,40.0
aktifitas yang bertujuan untu berpindah dari satu tempat ke tempat lainnya dengan efisien ,20.0,25.0,25.0,23.333333333333332
parkour adalah sebuah kegiatan yang dibutuhkan nyali besar karena parkour adalah sebuah kegiatan yang melompati antar gedung gedung tinggi ,32.0,40.0,50.0,40.666666666666664
meloncat di atas gedung ,18.0,10.0,10.0,12.666666666666666
kegiatan manuasia untuk berpindah dari satu tempat ke tempat yang lain secepatnya contoh tempatnya adalah taman rumah dll ,28.0,30.0,25.0,27.666666666666668
parkour free running merupakan gerakanaktifitas yang bertujuan untuk berpindah tempat dengan efisiensi dan waktu yang secepatnya di taman ,20.0,30.0,25.0,25.0
parkour adalah seni gerak atau aktivitas yang bertujuan untuk berpindah dari satu tempat ke tempat lain dengan efisian dan secepatcepatnya menggunakan prinsip kemampuan tubuh manusia tempat yang dapat digunakan adalah cabangcabang pohon batubatuan hingga pegangan tangan dan tembok beton ,40.0,45.0,50.0,45.0
parkour adalah seni olahraga melompat biasanya bisa dilakukan parkour di gedung  gedung jalan jembatan dan lain lain ,44.0,48.0,50.0,47.333333333333336
parkour adalah sebuah olahraga ekstrim yang di lakukan oleh profesional ,30.0,30.0,25.0,28.333333333333332
parkour adalah jenis olahraga berlari dan melompat diantara gedung gedung tinggi yang mengandalkan kecepatan kaki dan kekuatan tangan tempatnya biasanya diatas gedung apartemen atap rumah pohon pohon ,44.0,60.0,50.0,51.333333333333336
parkour adalah cara untuk menuju suatu tempat tujuan dengan efisien ,32.0,10.0,25.0,22.333333333333332
parkour adalah olahraga urban yang lumayan ekstrim loncat antar gedung gedung beringkat atau bangunan tinggi di sebuah perkotaangedung bertingkat bangunan tinggi ,50.0,60.0,50.0,53.333333333333336
berpindah dari tempat satu ketempat yang lainnya ,25.0,10.0,25.0,20.0
parkour adalah aktivitas yang bertujuan untuk berpindah dari satu tempat ke tempat lain dengan efisen dan secepat cepatnya menggunkan prinsip kemampuan bdan manusia tempat parkour biasanya di perkampungan taman dll ,50.0,58.0,50.0,52.666666666666664
parkour adalah olahraga ekstrim parkour biasa dilakukan ditempat yang tinggi dan ekstrim ,30.0,30.0,25.0,28.333333333333332
parkour adalah olahraga yang mengandalkan kekuatan otot tangan kaki dan kelenturan ,27.0,30.0,25.0,27.333333333333332
parkour baca  paarkuur  kadangkadang disingkat pk atau l art du deplacement seni gerak adalah aktivitas yang bertujuan untuk berpindah dari satu tempat ke tempat lainnya dengan efisien dan secepatcepatnya menggunakan prinsip kemampuan badan manusia itu berarti untuk menolong seseorang melintasi rintangan yang bisa berupa apa saja di sekitar lingkungan dari cabangcabang pohon dan batubatuan hingga pegangan tangan dan tembok beton yang bisa dilatih di desa dan di kota ,48.0,55.0,50.0,51.0
parkour ialah aktivitas yang bertujuan untuk berpindah dari satu tempat ke tempat lainnya dengan efisien dan secepatcepatnya menggunakan prinsip kemampuan badan manusia ,50.0,55.0,50.0,51.666666666666664
parkour adalah seni bergerak dan metode latihan natural yang bertujuan untuk membantu manusia bergerak dengan cepat dan eficien di gedung  gedung ,44.0,55.0,50.0,49.666666666666664
parkour baca  paarkuur  kadangkadang disingkat pk atau l art du déplacement seni gerak adalah aktivitas yang bertujuan untuk berpindah dari satu tempat ke tempat lainnya dengan efisien dan secepatcepatnya menggunakan prinsip kemampuan badan manusia itu berarti untuk menolong seseorang melintasi rintangan yang bisa berupa apa saja di sekitar lingkungan dari cabangcabang pohon dan batubatuan hingga pegangan tangan dan tembok beton yang bisa dilatih di desa dan di kota beberapa media menyebut istilah traceur atau traceuse untuk perempuan untuk penggiat parkour hal ini tidak sepenuhnya salah namun pada kenyataannya sebutan traceur dan traceuse sesungguhnya adalah untuk praktisi parkour generasi pertama yang berlatih bersama david belle founder  pencipta parkour di prancis sedangkan untuk praktisi parkour generasi setelahnya lebih tepat jika disebut dengan parkour practitioner atau praktisi parkour atau sekarang sering disebut juga dengan parkour enthusiast orang yang berlatih parkour dengan sepenuh hati dan antusias parkour tidak bisa disebut sepenuhnya sebagai olahraga karena parkour tidak mengenal adanya kompetisi misal di sepakbola ada kompetisi sepakbola nasional kejuaraan misal di bulutangkis ada all england medali  medali  ataupun tingkatantingkatan misal di taekwondo atau beladiri lainnya disimbolkan dengan sabuk di parkour hanya dikenal istilah jamming untuk menggambarkan kegiatan kumpul bersama sambil berbagi teknik atau metode latihan sesama praktisi parkour juga tidak bisa disebut murni seni karena parkour tidak seperti dance yang mengedepankan keindahan dalam melakukan gerakan dan trik atau capoeira yang indah dalam jurus parkour lebih mengedepankan tentang bagaimana cara kita bergerak dari satu titik ke titik lainnya sedangkan keindahan adalah bonus untuk lebih tepatnya parkour lebih pas disebut sebagai aktivitas disiplin seperti apa bentuk disiplin di parkour mungkin anda bisa mulai mencari di web portal parkour indonesia dan bergabung di komunitas kota anda untuk mengetahui hal tersebut lebih dalam ,60.0,75.0,75.0,70.0
parkour adalah seni bergerak dan metode latihan natural yang bertujuan untuk membantu manusia bergerak dengan cepat dan eficien parkour mengunakan beberapa gerakan seperti berlari memanjat meloncat untuk melatih kemampuan manusia untuk melewati segala bentuk rintangan di berbagai situasi dan kondisi di lingkungan urban atau rural ,48.0,55.0,50.0,51.0
parkour adalah aktivitas yang bertujuan untuk berpindah dari satu tempat ke tempat lainnya dengan efisien dan secepatcepatnya menggunakan prinsip kemampuan badan manusia ,50.0,55.0,50.0,51.666666666666664
park adalah taman our adalah kita jadi taman kita ,0.0,0.0,0.0,1.0
olah raga exstrim yang dilakukan di tempat terbuka antara gedung ke gedung maupun jalan raya ,30.0,35.0,25.0,30.0
memarkirkan kendaraan dengan tepat dan pada tempatnya biasanya dipandu oleh jukir ,0.0,0.0,0.0,1.0
parkour adalah sebuah olahraga loncat dari atap gedung dan tempat yang biasa digunakan yaitu atap gedung hotel atap gedung mall ,38.0,45.0,50.0,44.333333333333336
parkour adalah jenis olahraga baru yang dilakukan dengan berlari dan meloncat melewati gedung dan tempat umum lainnya ,44.0,50.0,50.0,48.0
aktivitas yang bertujuan untuk berpindah dari satu tempat ke tempat lainnya dengan efisien dan secepatcepatnya menggunakan prinsip kemampuan badan manusia ,50.0,50.0,50.0,50.0
parkour itu melatih manusia agar bergerak cepat  tempat yg biasa dilakukan loncat dari gedung ke gedung lain atau dari atap rumah keatap rumah  agar organ tubuh semua bisa menjadi sehat contohnya coba saja maling laptop pasti dikejar 1 kampung dan anda lari mungkin itu bisa jadi yg namanya parkour ,40.0,65.0,50.0,51.666666666666664
parktaman ourkami jadi taman kami ,0.0,0.0,0.0,1.0
parkour adalah atraksi jalanan dengan mengkombinasikan lari dan gaya  gaya untuk menghindari rintangan ,30.0,35.0,25.0,30.0
parkour adalah aktivitas yang bertujuan untuk berpindah dari satu tempat ke tempat lainnya dengan efisien dan secepatcepatnya menggunakan prinsip kemampuan badan manusia itu berarti untuk menolong seseorang melintasi rintangan yang bisa berupa apa saja di sekitar lingkungan dari cabangcabang pohon dan batubatuan hingga pegangan tangan dan tembok beton yang bisa dilatih di desa dan di kota ,48.0,50.0,50.0,49.333333333333336
aktivitas yang bertujuan untuk berpindah dari satu tempat ke tempat lainnya dengan efisien dan secepatcepatnya menggunakan prinsip kemampuan badan manusia gedung tinggi ,55.0,60.0,50.0,55.0
seperti sabil ,0.0,0.0,0.0,1.0
parkour adalah sejenis olah raga dimana hal ini membutuhkan badan yang kuat ,30.0,18.0,25.0,24.333333333333332
