Jawaban Tanpa Stopword Not Tokenization,Manual 1,Manual 2,Manual 3,Rata Manual
mea masyarakat ekonomi asean memiliki pola mengintegrasikan ekonomi asean membentuk sistem perdagangan bebas negaranegara asean,50.0,50.0,50.0,50.0
mea agenda integrasi ekonomi negaranegara asean bertujuan menghilangkan meminimalisasi hambatanhambatan kegiatan ekonomi lintas kawasan perdagangan barang jasa investasi,78.0,80.0,75.0,77.66666666666667
masyarakat ekonomi asean kegiatan ekonomi prakarsai negaranegara asia tenggara,45.0,30.0,50.0,41.666666666666664
mea masyarakat ekonomi asean dimana pekerjaan negara si asia buka,38.0,30.0,25.0,31.0
masyarakat ekonomi asean,22.0,10.0,10.0,14.0
mea mensyaratkan penghapusan aturanaturan menghalangi perekrutan tenaga kerja asing,15.0,15.0,10.0,13.333333333333334
mea singkatan masyarakat ekonomi asean bertujuan meminimalisir hambatan kegiatan ekonomi lintas kawasan contohnya perdagangan barang jasa,75.0,80.0,75.0,76.66666666666667
mea bentuk integrasi ekonomi asean artian system perdagaangan bebas negaranegara asean indonesia sembilan negara anggota asean menyepakati perjanjian masyarakat ekonomi asean mea asean economic community aec,60.0,80.0,75.0,71.66666666666667
mea masyarakat ekonomi asia dimana masyarakat asia bebas memilih pekerjaan dimanapun ruang lingkup asia bebas masuk negara negara asia,48.0,70.0,50.0,56.0
mea singkatan masyarakat ekonomi asean memiliki pola mengintegrasikan ekonomu asean membentuk sistem perdagangan bebas free trade negaranegara anggota asean anggota asean indonesia menyepakati perjanjian masyarakat ekonomi asean mea istilah hadir indonesia dasarnya mea aec asean economic community,58.0,80.0,75.0,71.0
mea masyarakat ekonomi asean mea peraturan membebaskan keperluan negara asean perdagangan tenaga kerja,70.0,70.0,75.0,71.66666666666667
singkatan masyarakat ekonomi asean memiliki pola mengintegrasikan ekonomu asean membentuk sistem perdagangan bebas free trade negaranegara anggota asean anggota asean indonesia menyepakati perjanjian masyarakat ekonomi asean mea istilah hadir indonesia dasarnya mea aec asean economic community,55.0,80.0,75.0,70.0
kumpulan negaranegara asean membentuk pasar tunggal kawasan asia tenggara mengatasi ekonomi asean,40.0,45.0,50.0,45.0
mea masyarakat ekonomi asean dimana masyarakat asean berhak kerja negara asean,48.0,46.0,50.0,48.0
mea kepanjanggan masyarakat ekonomi asia bersaing lingkup asean,35.0,40.0,50.0,41.666666666666664
mea singkatan masyarakat ekonomi asia,30.0,10.0,25.0,21.666666666666668
meamasyarakat ekonomi asean bentuk kerjasama negara regional asean kerjasama meliputi kerjasama bidang perdagangan bidang istilah mea pasar bebas asean,50.0,45.0,50.0,48.333333333333336
mengintegrasikan ekonomi asean membentuk sistem perdagangan bebas negaranegara asean,48.0,45.0,50.0,47.666666666666664
mea singakatan masyarakat ekonomi asean kondisi dimana pasar bebas dibuka investor negeri mudah masuk indonesia,55.0,60.0,50.0,55.0
masyarakat ekonomi asean,25.0,10.0,25.0,20.0
mea kepanjangan masyarakat ekonomi asia membebaskan ekspor impor bahan makanan disekitar asia mea membebaskan pertukaran pekerja negeri negeri,43.0,50.0,50.0,47.666666666666664
integrasi ekonomi asean menghadapi perdagangan bebas antarnegaranegara asean1 negara anggota asean menyepakati perjanjian mea dirancang mewujudkan wawasan asean 2020 menghadapi persaingan teramat ketat mea negaranegara asean sumber daya manusia sdm trampil cerdas kompetitif negara anggota brunei filipina indonesia kamboja laos malaysia myanmar singapura thailand vietnam,67.0,65.0,75.0,69.0
mea masyarakat ekonomi asia ketahui mea atura disepakati negara asia dimana bursa kerja dimasuki bebas olehwarga negara asia warna negara indonesia mendaftar negara malaysia,43.0,50.0,50.0,47.666666666666664
mea singkatan masyarakat ekonomi asean bentuk kesepakatan negaranegara anggota asean membahas perkembangan ekonomi negaranegara negaranegara asean dipaksa beradaptasi rangka membangun komunitas mea,48.0,40.0,50.0,46.0
mea masyarakat ekonomi asean usaha program kesepakatan negara asean menggagas usaha menjadikan masyarakat lingkup asean berkembang maju bidang ekonomi mea bertujuan meningkatkan masyrakat melek ekonomi mencerdaskan masyrakat mensejahterakan masyarakat,48.0,50.0,50.0,49.333333333333336
mea agenda intregasi ekonomi negaranegara asean bertujuan meminimalisasi hambatan kegiatan ekonomi lintas kawasan,60.0,60.0,50.0,56.666666666666664
mea agenda integrasi ekonomi negara asean bertujuan menghilangkan meminimalisir hambatan kegiatan ekonomi lintas kawasan perdagangan barang jasa investasi,78.0,66.0,75.0,73.0
mea nama karakter imutlucu cantik anime toloveru,5.0,0.0,10.0,5.0
masyarakat ekonomi asean,25.0,10.0,10.0,15.0
pasar bebas,15.0,5.0,10.0,10.0
mea masyarakat ekonomi asean dimana kegiatan kerjasama perekonomian negara asean masyarakat asean aktifitas ekonominya kawasan asean bebas,50.0,45.0,50.0,48.333333333333336
mea singkatan masyarakat ekonomi asean mea kerjasama ekonomi negara asean negara anggota asean bebas menjalankan kegiatan ekonominya kawasan asean,64.0,50.0,50.0,54.666666666666664
masyarakat ekonomi asea,20.0,10.0,10.0,13.333333333333334
mea masyarakat ekonomi asia persatuan negara negara asia tenggara berkumpul menyepakati mea mea bertujuan menghimpun seluhruh anggota asean mewujudkan kestabilan ekonomi pangan kesehatan warga asean mea diharapkan negara negara asia tenggara bersaing negara belahan dunia expor impor barang asean bebas terbukanya pasar bebas asia tenggara,60.0,70.0,75.0,68.33333333333333
mea singkatan masyarakat ekonomi asean memiliki pola mengintegrasikan ekonomi asean membentuk sistem perdagangan bebas free trade negaranegara anggota asean anggota asean indonesia menyepakati perjanjian masyarakat ekonomi asean mea istilah hadir indonesia dasarnya mea aec asean economic community,56.0,40.0,50.0,48.666666666666664
mea singkatan masyarakat ekonomi asean memiliki pola mengintegrasikan ekonomi asean membentuk sistem perdagangan bebas negaranegara asean,55.0,60.0,50.0,55.0
mea agenda integrasi ekonomi negaranegara asean bertujuan menghilangkan meminimalisasi hambatanhambatan kegiatan ekonomi lintas kawasan perdagangan barang jasa investasi,70.0,65.0,75.0,70.0
masyarakat terintegrasi dimana perdangan bebas negaranegara anggota asean tujuan menjadikan kawasan stabil makmur,51.0,60.0,50.0,53.666666666666664
masyarakat ekonomi asean mea 2015 bahasa inggris asean economic community aec integrasi ekonomi asean menghadapi perdagangan bebas antarnegaranegara asean1 negara anggota asean menyepakati perjanjian mea dirancang mewujudkan wawasan asean 2020 menghadapi persaingan teramat ketat mea negaranegara asean sumber daya manusia sdm trampil cerdas kompetitif,80.0,80.0,75.0,78.33333333333333
mea agenda integrasi ekonomi negaranegara asean bertujuan menghilangkan meminimalisasi hambatanhambatan kegiatan ekonomi lintas kawasan perdagangan barang jasa investasi anggota asean indonesia menyepakati perjanjian masyarakat ekonomi asean mea istilah hadir indonesia dasarnya mea aec asean economic community,56.0,95.0,90.0,80.33333333333333
bentuk integrasi ekonomi asean artian system perdagaangan bebas negaranegara asean indonesia sembilan negara anggota asean menyepakati perjanjian masyarakat ekonomi asean mea asean economic community aec,40.0,50.0,50.0,46.666666666666664
masyarakat ekonomi asean,25.0,10.0,25.0,20.0
mea masyarakat ekonomi asean mea berhubungan kegiatan ekonomi negara asean,42.0,25.0,25.0,30.666666666666668
mea kepanjangan masyarakat ekonomi asean mea khusus masyarakat negara negara beruang lingkup asia tenggara bertujuan meningkatkan pengetahuan masyarakt usaha ekonomi mea dititik beratkan usaha menegah kebawah aagar usahanya berkualitas maju,54.0,40.0,50.0,48.0
masyarakat ekonomi asean,28.0,5.0,10.0,14.333333333333334
ekonomi asean,18.0,0.0,10.0,9.333333333333334
mea pergerakan ekonomi global memnyebabkan warga asean anggota negara asean,30.0,25.0,25.0,26.666666666666668
masyarakat ekonomi asean kesepakatan ekonomi ditaati wakil negara asean membolehkan perdaganngan negara bebas masuk negara dituju lingkup asean,48.0,35.0,50.0,44.333333333333336
mea pasar bebas asean kesempatan investor asing bebas investasi teknologi jasa delapan bidang negara anggota asean,58.0,40.0,50.0,49.333333333333336
masyarakat ekonomi asean mea 2015 bahasa inggris asean economic community aec integrasi ekonomi asean menghadapi perdagangan bebas antarnegaranegara asean negara anggota asean menyepakati perjanjian mea dirancang mewujudkan wawasan asean 2020 mea warga negara anggota asean memasuki negara angota asean mengembangkan dibeberapa sektor,70.0,65.0,75.0,70.0
mea aec bentuk kerjasama anggota negaranegara asean brunei filipina indonesia kamboja laos malaysia myanmar singapura thailand vietnam,20.0,25.0,20.0,21.666666666666668
mea persatuan asean bidang perekonomian,24.0,15.0,25.0,21.333333333333332
mea mansyarakat ekonomi asean perjanjian anggota negara asia tenggara bebas perdagangan teknologi dll,46.0,30.0,50.0,42.0
