Siswa,Jawaban,Manual 1,Manual 2,Manual 3,Rata Manual
siswa_468,"Berpikiran positif akan memberikan akibat yang luar biasa yaitu: - Terhindar dari stres, dengan mengontrol hidup dan pikiran kita untuk selalu berpikiran positif maka hidup kita akan menjadi lebih rileks dan terhindar dari stres. - Tubuh menjadi lebih sehat, berpikiran positif sangat berkaitan erat dengan kesehatan karena rasa takut, cemas, iri, cemburu dan masalah buruk lainnya membuat metabolisme tubuh menjadi terganggu sehingga mengakibatkan timbulnya penyakit. - Lebih percaya diri, saat kita berpikiran positif maka pikiran-pikiran buruk akan lebih mudah kita singkirkan sehingga kita menjadi lebih optimis dan percaya diri. - Lebih mudah untuk sukses, jika kita selalu berpikiran positif dalam menghadapi suatu keadaan maka pikiran kita lebih mudah untuk menimbang baik buruknya keputusan yang kita ambil sehingga kita lebih bijak dan memberikan solusi yang tepat dan untuk masa depan maka hidup kita akan menjadi lebih sukses dan berhasil. - Lebih fokus, saat kita mengerjakan sesuatu dengan selalu berpikiran positif maka pikiran kita menjadi lebih jernih sehingga akan lebih mudah fokus dalam mengerjakan sesuatu sehingga hidup kita lebih terorganisir dan manfaatnya kita bisa lebih mudah mengatur waktu dalam hidup kita. - Lebih berani, saat kita berpikiran positif maka kita akan mengubah pikiran-pikiran yang dapat melemahkan hidup kita menjadi sesuatu hal yang positif sehingga lebih berani saat menghadapi sesuatu. - Lebih banyak teman, saat kita selalu berpikiran positif maka secara otomatis keluarga dan teman-teman kita akan lebih senang berada dekat dengan kita dan membuat kita mempunyai banyak teman dan sahabat yang menyayangi kita. - Hidup akan lebih bahagia, berpikiran positif membuat kita selalu bisa bergembira, senang, tertawa bahkan bisa membantu orang-orang disekitar kita yang sedang mengalami persoalan dan tentunya hidup kita menjadi lebih berarti baik bagi diri sendiri, keluarga maupun teman-teman disekeliling kita.",55.0,60.0,75.0,63.333333333333336
siswa_469,berkelaluan berifikir absolut dalam sekalian situasi apapun,10.0,5.0,10.0,8.333333333333334
siswa_470,berkelaluan berifikir absolut dalam segala situasi apapun,10.0,5.0,10.0,8.333333333333334
siswa_471,berkelaluan berifikir absolut di sekalian situasi apapun,10.0,5.0,10.0,8.333333333333334
siswa_472,berkelaluan berifikir absolut di segala situasi apapun,10.0,5.0,10.0,8.333333333333334
siswa_473,berkelaluan berifikir positif dalam sekalian situasi apapun,10.0,5.0,10.0,8.333333333333334
siswa_474,berkelaluan berifikir positif dalam segala situasi apapun,10.0,5.0,10.0,8.333333333333334
siswa_475,berkelaluan berifikir positif di sekalian situasi apapun,10.0,5.0,10.0,8.333333333333334
siswa_476,berkelaluan berifikir positif di segala situasi apapun,10.0,5.0,10.0,8.333333333333334
siswa_477,selalu berifikir absolut dalam sekalian situasi apapun,10.0,5.0,10.0,8.333333333333334
siswa_478,selalu berifikir absolut dalam segala situasi apapun,10.0,5.0,10.0,8.333333333333334
siswa_479,selalu berifikir absolut di sekalian situasi apapun,10.0,5.0,10.0,8.333333333333334
siswa_480,selalu berifikir absolut di segala situasi apapun,10.0,5.0,10.0,8.333333333333334
siswa_481,selalu berifikir positif dalam sekalian situasi apapun,10.0,5.0,10.0,8.333333333333334
siswa_482,selalu berifikir positif dalam segala situasi apapun,10.0,5.0,10.0,8.333333333333334
siswa_483,selalu berifikir positif di sekalian situasi apapun,10.0,5.0,10.0,8.333333333333334
siswa_484,biar kita sebagai awak nan potif yg memiliki Jiwa dan Raga yang Lebih Sehat dan memiliki prestasi,16.0,10.0,10.0,12.0
siswa_485,biar kita sebagai awak yang potif yg memiliki Jiwa dan Raga yang Lebih Sehat dan memiliki prestasi,16.0,10.0,10.0,12.0
siswa_486,biar kita sebagai pribadi nan potif yg memiliki Jiwa dan Raga yang Lebih Sehat dan memiliki prestasi,16.0,10.0,10.0,12.0
siswa_487,biar kita sebagai pribadi yang potif yg memiliki Jiwa dan Raga yang Lebih Sehat dan memiliki prestasi,16.0,10.0,10.0,12.0
siswa_488,biar kita menjadi awak nan potif yg memiliki Jiwa dan Raga yang Lebih Sehat dan memiliki prestasi,16.0,10.0,10.0,12.0
siswa_489,biar kita menjadi awak yang potif yg memiliki Jiwa dan Raga yang Lebih Sehat dan memiliki prestasi,16.0,10.0,10.0,12.0
siswa_490,biar kita menjadi pribadi nan potif yg memiliki Jiwa dan Raga yang Lebih Sehat dan memiliki prestasi,16.0,10.0,10.0,12.0
siswa_491,biar kita menjadi pribadi yang potif yg memiliki Jiwa dan Raga yang Lebih Sehat dan memiliki prestasi,16.0,10.0,10.0,12.0
siswa_492,agar kita sebagai awak nan potif yg memiliki Jiwa dan Raga yang Lebih Sehat dan memiliki prestasi,16.0,10.0,10.0,12.0
siswa_493,agar kita sebagai awak yang potif yg memiliki Jiwa dan Raga yang Lebih Sehat dan memiliki prestasi,16.0,10.0,10.0,12.0
siswa_494,agar kita sebagai pribadi nan potif yg memiliki Jiwa dan Raga yang Lebih Sehat dan memiliki prestasi,16.0,10.0,10.0,12.0
siswa_495,agar kita sebagai pribadi yang potif yg memiliki Jiwa dan Raga yang Lebih Sehat dan memiliki prestasi,16.0,10.0,10.0,12.0
siswa_496,agar kita menjadi awak nan potif yg memiliki Jiwa dan Raga yang Lebih Sehat dan memiliki prestasi,16.0,10.0,10.0,12.0
siswa_497,agar kita menjadi awak yang potif yg memiliki Jiwa dan Raga yang Lebih Sehat dan memiliki prestasi,16.0,10.0,10.0,12.0
siswa_498,agar kita menjadi pribadi nan potif yg memiliki Jiwa dan Raga yang Lebih Sehat dan memiliki prestasi,16.0,10.0,10.0,12.0
siswa_499,"ikatan berfikur absolut cak atas berjiwa sehat adalah jika kita berfikir positif maka kita bisa terhindar dari setres, emosi, dan selain itu bisa membuat umur kita panjang",40.0,30.0,50.0,40.0
siswa_500,"ikatan berfikur absolut cak atas hidup sehat adalah jika kita berfikir positif maka kita bisa terhindar dari setres, emosi, dan selain itu bisa membuat umur kita panjang",40.0,30.0,50.0,40.0
siswa_501,"ikatan berfikur absolut dengan berjiwa sehat adalah jika kita berfikir positif maka kita bisa terhindar dari setres, emosi, dan selain itu bisa membuat umur kita panjang",40.0,30.0,50.0,40.0
siswa_502,"ikatan berfikur absolut dengan hidup sehat adalah jika kita berfikir positif maka kita bisa terhindar dari setres, emosi, dan selain itu bisa membuat umur kita panjang",40.0,30.0,50.0,40.0
siswa_503,"ikatan berfikur positif cak atas berjiwa sehat adalah jika kita berfikir positif maka kita bisa terhindar dari setres, emosi, dan selain itu bisa membuat umur kita panjang",40.0,30.0,50.0,40.0
siswa_504,"ikatan berfikur positif cak atas hidup sehat adalah jika kita berfikir positif maka kita bisa terhindar dari setres, emosi, dan selain itu bisa membuat umur kita panjang",40.0,30.0,50.0,40.0
siswa_505,"ikatan berfikur positif dengan berjiwa sehat adalah jika kita berfikir positif maka kita bisa terhindar dari setres, emosi, dan selain itu bisa membuat umur kita panjang",40.0,30.0,50.0,40.0
siswa_506,"ikatan berfikur positif dengan hidup sehat adalah jika kita berfikir positif maka kita bisa terhindar dari setres, emosi, dan selain itu bisa membuat umur kita panjang",40.0,30.0,50.0,40.0
siswa_507,"hubungan berfikur absolut cak atas berjiwa sehat adalah jika kita berfikir positif maka kita bisa terhindar dari setres, emosi, dan selain itu bisa membuat umur kita panjang",40.0,30.0,50.0,40.0
siswa_508,"hubungan berfikur absolut cak atas hidup sehat adalah jika kita berfikir positif maka kita bisa terhindar dari setres, emosi, dan selain itu bisa membuat umur kita panjang",40.0,30.0,50.0,40.0
siswa_509,"hubungan berfikur absolut dengan berjiwa sehat adalah jika kita berfikir positif maka kita bisa terhindar dari setres, emosi, dan selain itu bisa membuat umur kita panjang",40.0,30.0,50.0,40.0
siswa_510,"hubungan berfikur absolut dengan hidup sehat adalah jika kita berfikir positif maka kita bisa terhindar dari setres, emosi, dan selain itu bisa membuat umur kita panjang",40.0,30.0,50.0,40.0
siswa_511,"hubungan berfikur positif cak atas berjiwa sehat adalah jika kita berfikir positif maka kita bisa terhindar dari setres, emosi, dan selain itu bisa membuat umur kita panjang",40.0,30.0,50.0,40.0
siswa_512,"hubungan berfikur positif cak atas hidup sehat adalah jika kita berfikir positif maka kita bisa terhindar dari setres, emosi, dan selain itu bisa membuat umur kita panjang",40.0,30.0,50.0,40.0
siswa_513,"hubungan berfikur positif dengan berjiwa sehat adalah jika kita berfikir positif maka kita bisa terhindar dari setres, emosi, dan selain itu bisa membuat umur kita panjang",40.0,30.0,50.0,40.0
siswa_514,andaikan kita bekerja absolut alkisah akan terhindar dari stres dan umur yang panjang,35.0,25.0,25.0,28.333333333333332
siswa_515,andaikan kita bekerja absolut maka akan terhindar dari stres dan umur yang panjang,35.0,25.0,25.0,28.333333333333332
siswa_516,andaikan kita bekerja positif alkisah akan terhindar dari stres dan umur yang panjang,35.0,25.0,25.0,28.333333333333332
siswa_517,andaikan kita bekerja positif maka akan terhindar dari stres dan umur yang panjang,35.0,25.0,25.0,28.333333333333332
siswa_518,andaikan kita berpikir absolut alkisah akan terhindar dari stres dan umur yang panjang,35.0,25.0,25.0,28.333333333333332
siswa_519,andaikan kita berpikir absolut maka akan terhindar dari stres dan umur yang panjang,35.0,25.0,25.0,28.333333333333332
siswa_520,andaikan kita berpikir positif alkisah akan terhindar dari stres dan umur yang panjang,35.0,25.0,25.0,28.333333333333332
siswa_521,andaikan kita berpikir positif maka akan terhindar dari stres dan umur yang panjang,35.0,25.0,25.0,28.333333333333332
siswa_522,jika kita bekerja absolut alkisah akan terhindar dari stres dan umur yang panjang,35.0,25.0,25.0,28.333333333333332
siswa_523,jika kita bekerja absolut maka akan terhindar dari stres dan umur yang panjang,35.0,25.0,25.0,28.333333333333332
siswa_524,jika kita bekerja positif alkisah akan terhindar dari stres dan umur yang panjang,35.0,25.0,25.0,28.333333333333332
siswa_525,jika kita bekerja positif maka akan terhindar dari stres dan umur yang panjang,35.0,25.0,25.0,28.333333333333332
siswa_526,jika kita berpikir absolut alkisah akan terhindar dari stres dan umur yang panjang,35.0,25.0,25.0,28.333333333333332
siswa_527,jika kita berpikir absolut maka akan terhindar dari stres dan umur yang panjang,35.0,25.0,25.0,28.333333333333332
siswa_528,jika kita berpikir positif alkisah akan terhindar dari stres dan umur yang panjang,35.0,25.0,25.0,28.333333333333332
siswa_529,angsal melindungi sekalian bagai penyakit.,5.0,2.0,10.0,5.666666666666667
siswa_530,angsal melindungi sekalian macam penyakit.,5.0,2.0,10.0,5.666666666666667
siswa_531,angsal melindungi segala bagai penyakit.,5.0,2.0,10.0,5.666666666666667
siswa_532,angsal melindungi segala macam penyakit.,5.0,2.0,10.0,5.666666666666667
siswa_533,angsal menjaga sekalian bagai penyakit.,5.0,2.0,10.0,5.666666666666667
siswa_534,angsal menjaga sekalian macam penyakit.,5.0,2.0,10.0,5.666666666666667
siswa_535,angsal menjaga segala bagai penyakit.,5.0,2.0,10.0,5.666666666666667
siswa_536,angsal menjaga segala macam penyakit.,5.0,2.0,10.0,5.666666666666667
siswa_537,dapat melindungi sekalian bagai penyakit.,5.0,2.0,10.0,5.666666666666667
siswa_538,dapat melindungi sekalian macam penyakit.,5.0,2.0,10.0,5.666666666666667
siswa_539,dapat melindungi segala bagai penyakit.,5.0,2.0,10.0,5.666666666666667
siswa_540,dapat melindungi segala macam penyakit.,5.0,2.0,10.0,5.666666666666667
siswa_541,dapat menjaga sekalian bagai penyakit.,5.0,2.0,10.0,5.666666666666667
siswa_542,dapat menjaga sekalian macam penyakit.,5.0,2.0,10.0,5.666666666666667
siswa_543,dapat menjaga segala bagai penyakit.,5.0,2.0,10.0,5.666666666666667
siswa_544,"mengelola stress cak atas baik, arwah dan raga lebih sehat, mengatasi masalah dengan tepat, hidup lebih terarah. kenapa bisa begitu,, karena dalam tubuh yang sehat terdapat jiwa yang kuat.",22.0,30.0,25.0,25.666666666666668
siswa_545,"mengelola stress cak atas baik, jiwa dan raga lebih sehat, mengatasi masalah dengan tepat, hidup lebih terarah. kenapa bisa begitu,, karena dalam tubuh yang sehat terdapat jiwa yang kuat.",22.0,30.0,25.0,25.666666666666668
siswa_546,"mengelola stress dengan baik, arwah dan raga lebih sehat, mengatasi masalah dengan tepat, hidup lebih terarah. kenapa bisa begitu,, karena dalam tubuh yang sehat terdapat jiwa yang kuat.",22.0,30.0,25.0,25.666666666666668
siswa_547,Berfikir absolut amat berangkaian cak atas pola hidup sehat karena dari berfikir yang positif akan bisa menjadikan hidup yang sehat karena tidak terjadi beban fikiran.,29.0,40.0,50.0,39.666666666666664
siswa_548,Berfikir absolut amat berangkaian dengan pola hidup sehat karena dari berfikir yang positif akan bisa menjadikan hidup yang sehat karena tidak terjadi beban fikiran.,29.0,40.0,50.0,39.666666666666664
siswa_549,Berfikir absolut amat berhubungan cak atas pola hidup sehat karena dari berfikir yang positif akan bisa menjadikan hidup yang sehat karena tidak terjadi beban fikiran.,29.0,40.0,50.0,39.666666666666664
siswa_550,Berfikir absolut amat berhubungan dengan pola hidup sehat karena dari berfikir yang positif akan bisa menjadikan hidup yang sehat karena tidak terjadi beban fikiran.,29.0,40.0,50.0,39.666666666666664
siswa_551,Berfikir absolut sangat berangkaian cak atas pola hidup sehat karena dari berfikir yang positif akan bisa menjadikan hidup yang sehat karena tidak terjadi beban fikiran.,29.0,40.0,50.0,39.666666666666664
siswa_552,Berfikir absolut sangat berangkaian dengan pola hidup sehat karena dari berfikir yang positif akan bisa menjadikan hidup yang sehat karena tidak terjadi beban fikiran.,29.0,40.0,50.0,39.666666666666664
siswa_553,Berfikir absolut sangat berhubungan cak atas pola hidup sehat karena dari berfikir yang positif akan bisa menjadikan hidup yang sehat karena tidak terjadi beban fikiran.,29.0,40.0,50.0,39.666666666666664
siswa_554,Berfikir absolut sangat berhubungan dengan pola hidup sehat karena dari berfikir yang positif akan bisa menjadikan hidup yang sehat karena tidak terjadi beban fikiran.,29.0,40.0,50.0,39.666666666666664
siswa_555,Berfikir positif amat berangkaian cak atas pola hidup sehat karena dari berfikir yang positif akan bisa menjadikan hidup yang sehat karena tidak terjadi beban fikiran.,29.0,40.0,50.0,39.666666666666664
siswa_556,Berfikir positif amat berangkaian dengan pola hidup sehat karena dari berfikir yang positif akan bisa menjadikan hidup yang sehat karena tidak terjadi beban fikiran.,29.0,40.0,50.0,39.666666666666664
siswa_557,Berfikir positif amat berhubungan cak atas pola hidup sehat karena dari berfikir yang positif akan bisa menjadikan hidup yang sehat karena tidak terjadi beban fikiran.,29.0,40.0,50.0,39.666666666666664
siswa_558,Berfikir positif amat berhubungan dengan pola hidup sehat karena dari berfikir yang positif akan bisa menjadikan hidup yang sehat karena tidak terjadi beban fikiran.,29.0,40.0,50.0,39.666666666666664
siswa_559,Berfikir positif sangat berangkaian cak atas pola hidup sehat karena dari berfikir yang positif akan bisa menjadikan hidup yang sehat karena tidak terjadi beban fikiran.,29.0,40.0,50.0,39.666666666666664
siswa_560,Berfikir positif sangat berangkaian dengan pola hidup sehat karena dari berfikir yang positif akan bisa menjadikan hidup yang sehat karena tidak terjadi beban fikiran.,29.0,40.0,50.0,39.666666666666664
siswa_561,Berfikir positif sangat berhubungan cak atas pola hidup sehat karena dari berfikir yang positif akan bisa menjadikan hidup yang sehat karena tidak terjadi beban fikiran.,29.0,40.0,50.0,39.666666666666664
siswa_562,berfikir absolut berkenaan arketipe berjiwa sehat yaitu dalam pikiran yang positif akan menimbulkan sikap untuk memiliki pola hidup sehat sebaliknya jika pikiran negatif pasti memilih pola hidup yang tidak sehat,32.0,40.0,50.0,40.666666666666664
siswa_563,berfikir absolut berkenaan arketipe hidup sehat yaitu dalam pikiran yang positif akan menimbulkan sikap untuk memiliki pola hidup sehat sebaliknya jika pikiran negatif pasti memilih pola hidup yang tidak sehat,32.0,40.0,50.0,40.666666666666664
siswa_564,berfikir absolut berkenaan pola berjiwa sehat yaitu dalam pikiran yang positif akan menimbulkan sikap untuk memiliki pola hidup sehat sebaliknya jika pikiran negatif pasti memilih pola hidup yang tidak sehat,32.0,40.0,50.0,40.666666666666664
siswa_565,berfikir absolut berkenaan pola hidup sehat yaitu dalam pikiran yang positif akan menimbulkan sikap untuk memiliki pola hidup sehat sebaliknya jika pikiran negatif pasti memilih pola hidup yang tidak sehat,32.0,40.0,50.0,40.666666666666664
siswa_566,berfikir absolut terhadap arketipe berjiwa sehat yaitu dalam pikiran yang positif akan menimbulkan sikap untuk memiliki pola hidup sehat sebaliknya jika pikiran negatif pasti memilih pola hidup yang tidak sehat,32.0,40.0,50.0,40.666666666666664
siswa_567,berfikir absolut terhadap arketipe hidup sehat yaitu dalam pikiran yang positif akan menimbulkan sikap untuk memiliki pola hidup sehat sebaliknya jika pikiran negatif pasti memilih pola hidup yang tidak sehat,32.0,40.0,50.0,40.666666666666664
siswa_568,berfikir absolut terhadap pola berjiwa sehat yaitu dalam pikiran yang positif akan menimbulkan sikap untuk memiliki pola hidup sehat sebaliknya jika pikiran negatif pasti memilih pola hidup yang tidak sehat,32.0,40.0,50.0,40.666666666666664
siswa_569,berfikir absolut terhadap pola hidup sehat yaitu dalam pikiran yang positif akan menimbulkan sikap untuk memiliki pola hidup sehat sebaliknya jika pikiran negatif pasti memilih pola hidup yang tidak sehat,32.0,40.0,50.0,40.666666666666664
siswa_570,berfikir positif berkenaan arketipe berjiwa sehat yaitu dalam pikiran yang positif akan menimbulkan sikap untuk memiliki pola hidup sehat sebaliknya jika pikiran negatif pasti memilih pola hidup yang tidak sehat,32.0,40.0,50.0,40.666666666666664
siswa_571,berfikir positif berkenaan arketipe hidup sehat yaitu dalam pikiran yang positif akan menimbulkan sikap untuk memiliki pola hidup sehat sebaliknya jika pikiran negatif pasti memilih pola hidup yang tidak sehat,32.0,40.0,50.0,40.666666666666664
siswa_572,berfikir positif berkenaan pola berjiwa sehat yaitu dalam pikiran yang positif akan menimbulkan sikap untuk memiliki pola hidup sehat sebaliknya jika pikiran negatif pasti memilih pola hidup yang tidak sehat,32.0,40.0,50.0,40.666666666666664
siswa_573,berfikir positif berkenaan pola hidup sehat yaitu dalam pikiran yang positif akan menimbulkan sikap untuk memiliki pola hidup sehat sebaliknya jika pikiran negatif pasti memilih pola hidup yang tidak sehat,32.0,40.0,50.0,40.666666666666664
siswa_574,berfikir positif terhadap arketipe berjiwa sehat yaitu dalam pikiran yang positif akan menimbulkan sikap untuk memiliki pola hidup sehat sebaliknya jika pikiran negatif pasti memilih pola hidup yang tidak sehat,32.0,40.0,50.0,40.666666666666664
siswa_575,berfikir positif terhadap arketipe hidup sehat yaitu dalam pikiran yang positif akan menimbulkan sikap untuk memiliki pola hidup sehat sebaliknya jika pikiran negatif pasti memilih pola hidup yang tidak sehat,32.0,40.0,50.0,40.666666666666664
siswa_576,berfikir positif terhadap pola berjiwa sehat yaitu dalam pikiran yang positif akan menimbulkan sikap untuk memiliki pola hidup sehat sebaliknya jika pikiran negatif pasti memilih pola hidup yang tidak sehat,32.0,40.0,50.0,40.666666666666664
siswa_577,-lebih berprestasi -jiwa bersama badan lebih sehat -Memiliki Banyak Teman -Mengatasi Masalah dengan Tepat -Terhindar dari Ceroboh -Hidup Lebih Terarah -Hubungan Keluarga dan Pasangan yang Harmonis -Menjadi Pribadi Pemberani -Menjadi Diri Sendiri -Pribadi yang Pantang Menyerah -Memiliki Sikap Lapang Dada,23.0,35.0,25.0,27.666666666666668
siswa_578,-lebih berprestasi -jiwa bersama raga lebih sehat -Memiliki Banyak Teman -Mengatasi Masalah dengan Tepat -Terhindar dari Ceroboh -Hidup Lebih Terarah -Hubungan Keluarga dan Pasangan yang Harmonis -Menjadi Pribadi Pemberani -Menjadi Diri Sendiri -Pribadi yang Pantang Menyerah -Memiliki Sikap Lapang Dada,23.0,35.0,25.0,27.666666666666668
siswa_579,-lebih berprestasi -jiwa dan badan lebih sehat -Memiliki Banyak Teman -Mengatasi Masalah dengan Tepat -Terhindar dari Ceroboh -Hidup Lebih Terarah -Hubungan Keluarga dan Pasangan yang Harmonis -Menjadi Pribadi Pemberani -Menjadi Diri Sendiri -Pribadi yang Pantang Menyerah -Memiliki Sikap Lapang Dada,23.0,35.0,25.0,27.666666666666668
siswa_580,memencilkan adicita yg berkarakter minus,5.0,5.0,10.0,6.666666666666667
siswa_581,memencilkan adicita yg berkarakter negatif,5.0,5.0,10.0,6.666666666666667
siswa_582,memencilkan adicita yg bersifat minus,5.0,5.0,10.0,6.666666666666667
siswa_583,memencilkan adicita yg bersifat negatif,5.0,5.0,10.0,6.666666666666667
siswa_584,memencilkan pemikiran yg berkarakter minus,5.0,5.0,10.0,6.666666666666667
siswa_585,memencilkan pemikiran yg berkarakter negatif,5.0,5.0,10.0,6.666666666666667
siswa_586,memencilkan pemikiran yg bersifat minus,5.0,5.0,10.0,6.666666666666667
siswa_587,memencilkan pemikiran yg bersifat negatif,5.0,5.0,10.0,6.666666666666667
siswa_588,menghindari adicita yg berkarakter minus,5.0,5.0,10.0,6.666666666666667
siswa_589,menghindari adicita yg berkarakter negatif,5.0,5.0,10.0,6.666666666666667
siswa_590,menghindari adicita yg bersifat minus,5.0,5.0,10.0,6.666666666666667
siswa_591,menghindari adicita yg bersifat negatif,5.0,5.0,10.0,6.666666666666667
siswa_592,menghindari pemikiran yg berkarakter minus,5.0,5.0,10.0,6.666666666666667
siswa_593,menghindari pemikiran yg berkarakter negatif,5.0,5.0,10.0,6.666666666666667
siswa_594,menghindari pemikiran yg bersifat minus,5.0,5.0,10.0,6.666666666666667
siswa_595,andaikan kita bekerja berkelaluan absolut tubuh kita akan merespon dengan perilaku dan pola hidup kita menjadi sehat,22.0,25.0,25.0,24.0
siswa_596,andaikan kita bekerja berkelaluan positif tubuh kita akan merespon dengan perilaku dan pola hidup kita menjadi sehat,22.0,25.0,25.0,24.0
siswa_597,andaikan kita bekerja selalu absolut tubuh kita akan merespon dengan perilaku dan pola hidup kita menjadi sehat,22.0,25.0,25.0,24.0
siswa_598,andaikan kita bekerja selalu positif tubuh kita akan merespon dengan perilaku dan pola hidup kita menjadi sehat,22.0,25.0,25.0,24.0
siswa_599,andaikan kita berpikir berkelaluan absolut tubuh kita akan merespon dengan perilaku dan pola hidup kita menjadi sehat,22.0,25.0,25.0,24.0
siswa_600,andaikan kita berpikir berkelaluan positif tubuh kita akan merespon dengan perilaku dan pola hidup kita menjadi sehat,22.0,25.0,25.0,24.0
siswa_601,andaikan kita berpikir selalu absolut tubuh kita akan merespon dengan perilaku dan pola hidup kita menjadi sehat,22.0,25.0,25.0,24.0
siswa_602,andaikan kita berpikir selalu positif tubuh kita akan merespon dengan perilaku dan pola hidup kita menjadi sehat,22.0,25.0,25.0,24.0
siswa_603,bila kita bekerja berkelaluan absolut tubuh kita akan merespon dengan perilaku dan pola hidup kita menjadi sehat,22.0,25.0,25.0,24.0
siswa_604,bila kita bekerja berkelaluan positif tubuh kita akan merespon dengan perilaku dan pola hidup kita menjadi sehat,22.0,25.0,25.0,24.0
siswa_605,bila kita bekerja selalu absolut tubuh kita akan merespon dengan perilaku dan pola hidup kita menjadi sehat,22.0,25.0,25.0,24.0
siswa_606,bila kita bekerja selalu positif tubuh kita akan merespon dengan perilaku dan pola hidup kita menjadi sehat,22.0,25.0,25.0,24.0
siswa_607,bila kita berpikir berkelaluan absolut tubuh kita akan merespon dengan perilaku dan pola hidup kita menjadi sehat,22.0,25.0,25.0,24.0
siswa_608,bila kita berpikir berkelaluan positif tubuh kita akan merespon dengan perilaku dan pola hidup kita menjadi sehat,22.0,25.0,25.0,24.0
siswa_609,bila kita berpikir selalu absolut tubuh kita akan merespon dengan perilaku dan pola hidup kita menjadi sehat,22.0,25.0,25.0,24.0
siswa_610,"anggapan absolut angsal bersedekah advis yang baik pada tubuh, sehingga tubuhpun dapat menjalani pola hidup sehat",28.0,25.0,25.0,26.0
siswa_611,"anggapan absolut angsal bersedekah sugesti yang baik pada tubuh, sehingga tubuhpun dapat menjalani pola hidup sehat",28.0,25.0,25.0,26.0
siswa_612,"anggapan absolut angsal memberi advis yang baik pada tubuh, sehingga tubuhpun dapat menjalani pola hidup sehat",28.0,25.0,25.0,26.0
siswa_613,"anggapan absolut angsal memberi sugesti yang baik pada tubuh, sehingga tubuhpun dapat menjalani pola hidup sehat",28.0,25.0,25.0,26.0
siswa_614,"anggapan absolut dapat bersedekah advis yang baik pada tubuh, sehingga tubuhpun dapat menjalani pola hidup sehat",28.0,25.0,25.0,26.0
siswa_615,"anggapan absolut dapat bersedekah sugesti yang baik pada tubuh, sehingga tubuhpun dapat menjalani pola hidup sehat",28.0,25.0,25.0,26.0
siswa_616,"anggapan absolut dapat memberi advis yang baik pada tubuh, sehingga tubuhpun dapat menjalani pola hidup sehat",28.0,25.0,25.0,26.0
siswa_617,"anggapan absolut dapat memberi sugesti yang baik pada tubuh, sehingga tubuhpun dapat menjalani pola hidup sehat",28.0,25.0,25.0,26.0
siswa_618,"anggapan positif angsal bersedekah advis yang baik pada tubuh, sehingga tubuhpun dapat menjalani pola hidup sehat",28.0,25.0,25.0,26.0
siswa_619,"anggapan positif angsal bersedekah sugesti yang baik pada tubuh, sehingga tubuhpun dapat menjalani pola hidup sehat",28.0,25.0,25.0,26.0
siswa_620,"anggapan positif angsal memberi advis yang baik pada tubuh, sehingga tubuhpun dapat menjalani pola hidup sehat",28.0,25.0,25.0,26.0
siswa_621,"anggapan positif angsal memberi sugesti yang baik pada tubuh, sehingga tubuhpun dapat menjalani pola hidup sehat",28.0,25.0,25.0,26.0
siswa_622,"anggapan positif dapat bersedekah advis yang baik pada tubuh, sehingga tubuhpun dapat menjalani pola hidup sehat",28.0,25.0,25.0,26.0
siswa_623,"anggapan positif dapat bersedekah sugesti yang baik pada tubuh, sehingga tubuhpun dapat menjalani pola hidup sehat",28.0,25.0,25.0,26.0
siswa_624,"anggapan positif dapat memberi advis yang baik pada tubuh, sehingga tubuhpun dapat menjalani pola hidup sehat",28.0,25.0,25.0,26.0
